text_stemming,pseudo_label
yak dah pakai tuh internet 150rbblnupto 300mbpsujan tinggalin biznet aplagi speedy gratis 1 bln pertama,positif
selalu buat baik nam myoho renge kyo,positif
ajar internet india jio kl dak salah kasih gratis internet sekali beli 6blm langsung kalang kabut dak sisa namanaya monopoly cerdas,positif
perintah dikonoha lg sadap data2 rakyatbiar gmpang pantau provokatorhati2,negatif
yg sy tau program gratis murah dri perintah gk gmpang dpetnypasti tugas lapang biaya tambah,positif
bahas coin ko,netral
bashar al assad,netral
uuj ujung ujung jawayang anak tiri,netral
nyoba daftar lokasi jawa barat daftar apa penuh batas,netral
betul bang lagi tuh surge numpang sana sini bekas optik salah satu paling buruk,netral
cerita,netral
terus,netral
kapan muncul internet rakyat sedang tunggu,netral
bukan murah kwalitas bagus,positif
yg potensi resiko gagal megang politis,negatif
aku uda daftar sampe sekarang kabar padahal aku jawa pusat segala pusat indonesia facebluesmiling,netral
aku alami pulkam hujan angin ngaruh wifinya kadang pagi gk koneksi inti harga kualitas tpi wilayah ku internet susah wifi rakyat lumayan bantu meski bnyk error,netral
d rmh wifi sdh 100 rbbulan,netral
tetap kuota selular butuh guna internet diem rumah,netral
bakal galbay indomie,netral
dukung malah sangat sangat buka upaya ira bener2 buat tinggal desa jauh dri kota ngerasain betapa mahal lamban internet gsm boro2 internet kabel moga ada ira jadi solusi buat desa2 jangkau internet kabel murah,netral
bolt versi 5g,netral
ulas tarik langkah sangat2 bagus internet murah 100rb orang kecimpung dunia internet wifi rtrw aku bs ngmng faktor penting stabilitas jaring lemah antena banding fiber optik awal2 cr cs tebal kuping,positif
kyj bolt jaman dulu,netral
arb video tayang,netral
untung rakyat ane dukung sdh terlalu lama bayar internet mahaljaringan suka itel klw hujanapalagi detik detik hari mw jatuh tempo tagihanbuset lot bikin naik darah,netral
baru jawa,netral
kenapasih pd pesimis orang optimis nyinyir jangan internet rakyat,netral
bahas sekali bang startlite,netral
operator bold mirip,netral
user luar jawa ijin nyimak,netral
kaya tau perintah indonesia,netral
bukan masalahoptimis vs pesimistapi otak brilian vs otak konslettyg jelas otak pkaisbelum nilai suatu halap lg soal internet rakyat inivendoroprator mana mau kasih quota keceoatan 100mbpsdengan harga 100rb doankbersukur perintah duli rakyat kecilmiskinuntuk hadir layan cepat 5g speet 100mbos harga 100rbkl gk mau makaigk usah pakaikl mau coba gratis router nyakl gk sesuailemot jaring nyagk usah bayar bulan depanenaksimple otak fress,positif
optimis vs pesimis dukung vs curiga biasa hubung paslon pilpres pikir positif eh pikir negatif bolehbebas,netral
karna buruk sejak kera masuk gorong2 sampe skrg tiap taun bayar utang woosh bayar awat ikn kira bakal uang rakyat ditarikin mungkin besar klo perintah mau ambil cuan dr inet rakyat harga 100rb tp inet super lot,netral
krn dukung paslon belah pas pilpres kemaren,netral
biasa kaum mulyono tonton dulu beres cermat isi video,netral
bukan pesimis skeptis realistis skeptis perlu kena bagi pikir kritis,netral
satu internet merah putih biaya bulan promo 20k bulan lama satu tahun fiber optic speed up to 50mbps bayar lewat koperasi desa merah putih bangun desa desa betul dekat rel kereta api sedang saing rtrw net 120k5mbps internet rakyat 100k100mbps starlite 100k200mbps wifi merah putih 20k50mbps jauh rtrw net tumbang duluan tahun mungkin sisa starlite merah putih isu satu tahun harga normal 170k bulan,netral
dimafiun internet gratis speed cepet,positif
aku beli paket 50 ribu 15 gb speed keong gk usah sebut kartu apa tau,netral
lagilagi apa yup skeptis apa gebrak bikin wow perintah skeptis dulu,netral
jalan luar wifi apa esim,netral
ijin bang fwa buka pakai operator fren joint smart fwa populer tahu akhir akhir gabung seng smart jadi smartfren makasih,netral
fup too good to be true,netral
bang alat bungkam misal milik sedia internetnya neng orang kan,netral
simak beking politik main belakang layar,netral
kyk rumah baru nyediain wifi wireless harga 140rb 10mbps emang klo ujan stabil bbrp kali eror jdi hrus restartcabut colok,positif
wifi rumah 100k bulan cepat internet kenceng,positif
moga revolusi internet murah kencang patok 100 mbps 100rb per bulan provider turun harga cepat naik utama internet fiber seluler,positif
orang bapak bapak pernah kata internet cepat apa,positif
duduk 275 juta jiwa 70 pakai internet dapat 192 5 juta langgan market konsumen sangat besar pasang iklan besar mesti internet gratis bayar tonton tv biaya internet tekan murah 1 rupiah,positif
lebih mati provider gsm vendor ngerjain tari kabel,netral
saing negara asia tenggara seperti perlu lokasi tower baru skema pasang antena bts fwabwa,netral
apa daya tinggal pelosok negeri,netral
too good to be true tengah perintah sekarang,netral
tarik coba siap rogoh kantong,netral
rumah viberlink 1 grup starlite surge harga 100k tembus 200mbps,netral
ngga skeptis sering masyarakat bohongin bikin gebrak 19 juta lapang kerja eh nyata ribu phk,netral
afiliasi usaha adik presiden rest in peace kolusi nepotisme,netral
war tiket wifi id dapet walaupun khawatir temen warnet kenceng malah dapet kunci ping backbone internet rakyat sangat tarik murah and hope can be execution,positif
anak2 kasih uang saku khusus internet tiap hari 20000 gara2 sekolah ajar pakai internet orangtua paksa tambah budget khusus beli kuota internet anak apa iya lama sekolah hp pegang terus anak2 anak lama waktu ajar sekolah hp kumpul mulai ajar kembali selesai belajarjam pulang sekolah,netral
pra registrasi blm kabar kabar,netral
tinggal berangus mafia2 kecil judul rtrw net,netral
pegang saham wifi jauh menang lelang yakin proyek hasil lama perintah sekarang,netral
omong prabowo denger percaya dulu bilang tunjang guru naik hingga 2 juta fakta omon omon doangterus bilang utang woosh nanggung fakta malah apbn dibebankansok hero doang orang depan kamera asli you know jauh omong manis politik era orde baru,netral
cabut indihome 6 hari lalu gila nunggu baik sampe 4 hari mahal layan leled,netral
in this economy ill take anything cheaperdi papua paket kombo internet 35 gb telkomsel harga pernah bawah 150rb lebih sering kisar 175rban arti 2 nomor at least udah nyedot 300400rb sendiri per bulandan alam jelek sekali paket mahal kecil mungkin nemubeli paket lebih murah mana curigain alas paket personal tawar langgan pilih telkomsel dasar masa langgan total pakai lama 3 bulan berturutturutandai coverage provider rival sini bagus mah yakin tinggalin provider biji,positif
myrep 110rb 10mbps akajalan 100mbps,netral
bang emang indonesia omon doang semua korupsi dluan,netral
inet 100mbps mbg,netral
udah coba daftar website internet rakyat hubung kata fwa sedang developmen terus saran pasang jaring fiber dulu ada,netral
dulu thn 2012 malaysia daftar internet 15 ringgit 1 bulan,netral
malaysia 30 ringgit malaysia 1 bulandan laju sangat super duper,netral
moga putus putus kayak my republic,netral
protes operator duluanyang ngotot protes simerah,netral
519 pas denger kereta ah sudah orang kalimantan,netral
strategi hampir kayak awal xiaomi ngacakngacak pasar smartphone indonesiadimana datang smartphone spek bagus harga lebih murah banding harga brand,positif
percuma bahas selalu mulai klo benar atur yah rakyat kapan liat benar mbg dimana2 beranta makan kurang layak sesuai mana ntar korupsi bgmn setaon dah liat banuak beeita kecewa hasil apa2 malah lebih aneh lg belum cm byk plan tp eksekusi selalu ada sj spt buat formalitas,netral
ds ku dekat dgn stasiun bener wifi 100 mbps rp100k kereta api lewat sinyal hilang bonus trobelnyabufferingtdk internet kata masang wifi jarak maxsimal 3 kilo stasiun kereta api starlite,netral
wow mantap skrng daftar ngga padahal tinggal bekas lewat online,positif
sekarang berapa perbulanya,netral
khusus buat pulau jawa manfaat fasilitas rel kereta daerah ikut prosedur paling aman untung usaha swasta buka pasar sahamsaya rasa bakal via jalan antar provinsi beberapa kilometer mukim padat baru pasang bts buat pancar sinyal 14 ghz modem wifi pasang rumah teknologi memang wireless,positif
kalimantan kan pegang tender myrep bukan surge,netral
tonton ulang coba bang biar paham,netral
klo pke jalur kereta starlite klo internet rakyat pke fwa,netral
awal tarik jujurr pas liat sharing modemrouter dah ttp platmerah 150mbps 435k,netral
tempat malah make tiang listrik plnjadi akses lebih luastapi diasaat jam sibuk super lelet,negatif
pakai tiang pln kan iconnet memang anak usaha pln,netral
kereta cepat kaga buat duit bikin rel kalimantan sumatra lumayan tuh ngangkut sawit batubara,positif
nyuruh pengusaha2 sawit patungan konglomerat indonesia mayoritas usaha sawit loh,netral
gimmick internet rakyat ideal infrastruktur rakyat tinggal murahin 4g malah bikin teknologi baru 5g fwa butuh infrastruktur lebih 4g ajar dulu karakter teknologi dulu terlalu cepat senang,netral
ohh pantes kuota xl paling murah diskon 90 dapet kuota vip 195 gb30 hari rp25000 relover sisa kuota rahasinya,positif
ragu udah registrasi bulan kemaren dateng dateng inisemoga bukan proyek gimmick,negatif
bang bahas projek stargate bikin harga ram naik,netral
orang kampung 100 ribu ngak ngelag si senang2 orang desa meski sdm rendah ngak se barbar orang kota merke trim,netral
bnyk kabel emg mangkas biaya produksi,netral
hancur usaha wifi kecil2 daerah,netral
beberapa lokasi provider backup link beberapa soho branch pedesaancontoh paling gampang mungkin cafe tetep pasang fiber optic beberapa kendala butuh akses cepat solusiatau box odp segel kemaren sempet baca berita box odp segel perintah tempat cuman lupa lokasi temporary solutionbahkan emergency bencana jadi contoh starlink kemarin penting backup electrical gensetkelemahan product wireless memang dar awal ada teknologi memang segi obstacle tembok interference perangkat mousekeyboard wireless bluetooth access point spektrum tentu gantung cuaca stabil electrical band rendah jangkau luas gantung cuaca band tinggi stabil jangkau kecil,positif
wow keren bang menang selamat moga terus beruntungdi,positif
entar jamban tampak,netral
100 mbps rp100000 udah lama depok sekarang ngebut,netral
100 mbps bukan lot 100mbps baru ngacir,netral
1049 detik paksa provider kntl 1 ahahahahaha,netral
lupa bolt ntar lengser paling gagal bayar sewa frekwensi akhir dibrendel,negatif
liat emang bakal kaya xiaomi ngancurin pasar hp abis bakal perang harga makin untung buat contoh sekarang hp murah2 utama transionnah internet indonesia lahan basah ingat duduk besar sea internetnya lambat mahal udah makin muak makin hari malah makin mahal paket pangkas 28 hari data sisa hangus akumulasi,negatif
benar gk klo emang iya campur tangan perintah gratisin gk perlu biaya bulan bantu masyarakat kecil akses internet benar salah satu program capres ganjar pranowo mengingkan akses internet gratis plosok negeri indonesia pak hasyim adik prabowo ambil ide guna tarif murah tetap untung pribadi lambat laun usaha wifi internet indonesia indihome biznet tenggelam ada program internet rakyat,positif
aku udah nyoba startlite 200mbps 100rbbln gratis bulan pertama bust trial bener tengah malem kenceng kuat min 50mbps klo pas jam sibuk dapet 5mbps udah alhamdulillah endingnya aku tetep make iconet 35mbps 250bln,positif
alhamdulillah klw rakyat,netral
jangan jangan proyek elite global kontrol seluruh umat manusia 5g covernya lebih luas 4g lebih sedikit blankspot,netral
inihome ganti strlite 265k 20mbps sekarang 100k 200mbps bulan pakai 4 bulan tadi kenceng sekarang lambat,netral
surge bkn main baru surge induk usaha macroad linikini ituloh tv lcd atas kereta commuter dr usaha,netral
indonesia barat indo timur jangan paket murah cepat jaringaringan 100mbtahun,positif
optimis krn indo qris dunia,netral
internet indo mahal minta ampun,negatif
mana daftar starlite udah lebih 1 bulan bulan dipasangpasang,netral
ko 100rbkarna lama internet ladang bisnis konglomerattapi ambil alih pemerintahharus lebih murah 100000,positif
proyek politik,netral
uda daftar bulan september 2025 sekarang rumah tu internet padahal rumah area jabodetabek,netral
berat bagus buat main game,positif
seeing is believing lebih tepat surfing is believing,netral
moga produk dibarengin after sales bagus lepas tangan depan,positif
akhir bahas,netral
emg bullshit sampah proyek internet,negatif
ormas sedih lihat cari peluang biar cuan ormas,netral
tetangga langgan 100 rbbulan pakai kabel fiber sekarang 100 rbbulan aneh,netral
ragu bakal bener kemaren eksekusi amburadul walaupun bukan program perintah,netral
saham wifi naik terus ni,netral
ken coba internet rakyat rumah internet udah mulai masalah terus,netral
kaget frekuensi beda sendiri nyata kemren usaha menang lelang,netral
ambil sisi positif nambah kabel semrawut makan korban,netral
cara mati umkm internet lokal resmi nanti tinggal main besar,netral
udah dapet seh mo nanya tu modem router make merk n tipe apa yananya kemana2 blm dpet jawabn,netral
wah nyata up to 100 doang nyata dibagi2 pakai kayak aku tetap bayar indihome mahal dehsetidaknya 100mbps bagi org2 rumah bukan kota harap ada saing indihome bakal kasi harga lebih murah,netral
scam omon doang,negatif
salah,netral
buyer tlkm indh mulai panas daftar tinggal nunggu ira pasang lalu putus tlkom rumah soal rumah wifinya edan speed 5 mb harga 150rbbulan lot ira 100mbbulan gratis pasang,positif
monopoli resiko buat rakyat guna,netral
k starlink,netral
konoha harga serba mahal barang jelek harga tetap mahal,negatif
bahasa kata kata abang mirip notebooklm,netral
bagus ide aku udah daftar preregister websitenya dah 1 bulan lalu tinggal realisasinyakeuntungan orang daerah pakai internet rakyat1 paling murah kantong oke2 umkm kayak warkopangkringan ringan biaya3 kabelkabel fiber sera tiang listrik ganggu bakal punah keinginanku4 bawa kan modem mobilmotor daki gunung mungkin enggak butuh beli pulsa penting bawa modem yakin kalang bakal ken,positif
mampus telkom lamalama,netral
terus gmana cara main papua rel kereta api,netral
sekarang nama internet umkm alias rtrw net murah lancar ganggu langsung gercep,positif
sangat bagus sekali proyek jalan sesuai rencana penting murah bagus terang atas jadi india,positif
game changer isp kasih harga jangkau masyarakat indonesia pelat merah baik kualitas jaring sesuai harga,positif
internet lancarr kompetitor geram sabotase jalan,netral
jujur lebih suka 24ghz kenceng tempat sendiri 50 ghz terlalu lemah,netral
beneran bagus aku sini peke wifi bulan 155rb haya 10 mbps doang,positif
ngeliat raymond chin jelasin serasa liat pak indrawan nugroho muda urai masalah,netral
my republick sinarmas masuk sumatera masuk tempat tinggal harga 100ribuan nanem tiang suka hati ijin tanah,netral
internet cepat buat apa bagus tumben gebrak baru kayak gin,positif
lebih murah ntar kena santet,positif
40 mbps maks handle internet 100 mbps 5 langgan waktu sama arti cepat 100 mbps hoax,positif
harap lebih ira bakal sangat syukur ada kabupaten harap provider ngalahin indiehome karna jaring punya kuota moga indehome sadar betapa maruknya pakai 10mbps 300k kan upgrade ehhh suruh bayar moga indihome sadar maruknya buat usaha hancur,netral
joss ko dukung emang trllu mahal internet sekarang,negatif
internet rakyat modem kartu polos udah 5g semakim jauh bts rumah apit bangunan2 tinggi makin bapuk beda fo,netral
murah gratis,positif
sistem kuota sistem paling scam indonesia mahal mana sedikit kuota,negatif
lhaaaa negara bumn sebut telkomkemana merekakok kalah lelang usaha kecilhmmm,netral
telkomsel paling mahal se jagat rayaaaa,negatif
ndak lihat potensi kkn jadi internet murah main politis bro ntah lihat adah sana,positif
proyek korupsi kayak mbg,netral
regestrtasi internet rakyat sekarang respon infoin nunggu antri padahal bulan registrasi,netral
mantap jelas penting coba dulu ntar butuh versi premium baru pindah provider pinting ngehemat uang kuota hp plat merah sayang benar plat merah sayang milik indonesia nambah devisa negara meski kadang sebal sayang adek si kuning jual mbak mega,positif
moga jadi revolusi internet indonesia,netral
hidup jawa selalu bnyk pilih coba dalam kalimaan kalimantan sini jangan 3t mya desa2 akses dr kecamantan lancar masalah jaring internet paling susah ada sinyal dr sutet telkomsel bakti sinyanya cuman sampe 300m doang kuat cepat plng besar 150kbps sisa krim chat wa centang 1 sukur,positif
praktisi jaring teknologi fwa lama saing fiber optik frekuensi radio sangat batas sangat mahal efektifitas ira kata tarik kabel fiber rumah langgan kalah biaya sewa frekuensi negara tau sewa keluarga si kuasa tementemen sini mau pasang ira pesan jangan gegabah jangan fomo tetap pikir logis prediksi awalawal pasang full 100 mbps beberapa bulan kemudian guna kalian mungkin sesal,negatif
buat apa internet harga mahal kualitas baik scam sampah,negatif
buat putar video gk boss,netral
buat buka video gk bro,netral
usaha rw ku piye,netral
hc san dulu si,netral
ken nanam saham situu,netral
emang beneran programkok tempat adem heboh,netral
bagus bakal babat rt rw ilegal abuse bandwidth isp,positif
lama review berat omon omon,netral
regulasi ketat perintah pro rakyat rakyat cerdas klo harga ubah signifikan pindah profider,netral
video 1030 merauke bukan elit pilih telkomsel tahun hampir 3 kali mati total internetnya sekali mati bulan lebih,netral
coba bang denger videovideo menkominfo panjang masa bpk onno widodo purbo,netral
aku dukung biar lini interconekted dl efek salah satu belanja jual online makin marak umkm geliat,netral
gk terlalu ngarepkmi desa jaring susah minta ampun,netral
percuma murah ping tinggi,positif
lanjut,netral
moga realisasi jalan baik ngeluh harga kuota bayar kepake telkomsel tau sendiri harga paket mahal mau pasang jaring fiber akses sampe rumah satu jalan saat gamau bikin jaring wireless starlink mahal ngelebihin telkomsel,negatif
emiten wifi laris manis prospek bagus blm tau barang kelola jelas skip dlu aj ikutin arah master waren sabar rupa tindak baik,positif
gak papa lama video youtube resolusi 1080p lot unlimited aku tuju ce harga 100rb lha pakek kuota 30 giga 1 bulan nyentuh angka 100rb malah kurang kuota padahal pakai banyak malah youtube,netral
bukan telkom laku padahal usaha negara rakyat,netral
ngalahin starlink klo gt,netral
gak walaupun ane bukan orang ada stabil koneksi no 1 bagus bukan monopoli,positif
aku masuk awal2 nie guna internet rakyat alam awal pasang tes cepat 17mbps protes kemudian setting ulang cepat kisar 7080mbps ping 40ms owh modem internet rakyat guna dual frekuensi 24ghz 5ghz cepat atas frekuensi 24ghz di5ghz cepat 188mbps neng laku kurang satu minggu pasang massif cepat internet down utama malam tadi 100mbps lebih 5mbps parah 05mbps pengaruh cepat internet lokal betul guna 2 jaring internet rumah semenjak pasang internet rakyat massif cepat internet lokal dampak owh tuduh raimond sepenuh benar gk sepenuh salah alas,positif
coba dulu mumpung murah depan kecewa mahal,netral
sempat ngerasain optik laut putus waktu merauke asmat 3 tahun papsel tiap tahun jadi kayak gitu untung skrg udah starlink bantu harga paket lumayan mahal,negatif
pilih monopoli dgn kualitas bobrok mahal,negatif
fakfak kabel laut putus acara tahun,netral
pakai indihome tetep tiap hari masalah,netral
,netral
survei lapang kata jual perintah bikin mahal harga potong masa aktif salah satu produk esemka tahap 2 kemarin koar sekolah gratis lewat entah gimmick,negatif
tau kadang mati,netral
oprator duluan jamin usik2,netral
provider sekarang kuota mahal,negatif
desa lama nikmat internet 100 ribu bulan bukan sedia perintah sedia lokal,netral
gamers perlu ping kecil harga 200000 bulan,netral
bener keinget kasus india karna mungkin sama usaha sedia layan internet udah kongkalikong gila2an harga butuh 1 beda buat hancur sistem,netral
paham web baca syarat ketentuanjadi yakin bukan program bener,netral
influencer udh mulai bahas arti sell on news ges arb tiga serok,netral
yg herandi indo serba mahal dulu tv kabel mahal sekarang tv kabel sdh ganti stb gratis,negatif
sejak tipu akun raymond ngga pernah percaya omong,negatif
lemah fiber optic rawan petir,netral
tempat blm adatapi bekas adasodara sudh mudah2n sampe tempat sayasaya domisili cileungsi bogor,netral
arti cocok wilayah jawa sedia bukan pulaupulau emang butuh malah lebih mentingin pulau jawa padahal orang jawa guna internetnya jauh lebih masif ketimbang pulau,netral
yg takut pas negara masalah butuh informasi tiba tiba jaring ilang beberapa alas jelas jaring lebih mudah kontrol,netral
too good to be true daerah internet diplosok plosok dgn harga 100k cuman speednya ratarata 2mbpsan sya 10mbpsan dgn harga faktor koneksi so internet rakyat too good to hear eksekusi kurang 50 narasi tetep upgradenya wow sekali banding internet plosokan skrg,netral
ingat bolt gelontor modal,netral
mau murah gampang hapus biaya frekuensi sikat ormas das maupun lapang harga murah,positif
paling bbrpa bulan kemudian naik tinggikecepatan berkurg,netral
proyek perintah scam,negatif
harap baik,positif
right issue,netral
sell on news apa tuh bang,netral
tipu apa,negatif
saran utk bagi editor coba sfx reverse cymbal sekal ganti gatel dengernya mulu tiap muncul,netral
tekolommsel bukan makin murahtp makin mahal,negatif
aku pasang surge lumayan 200mbps jam siang turun jauh rebut soal hahaha,netral
contoh nyata my repvblik 100 mbps doenload lot malah lebih cepat xl 30 mbpsjangan percaya bungkus politik,positif
buset dah izin ormas,netral
bang bom bahas awat layan 2 bagus nyaman langgan bicara tau dulu pernah iconnet memang murat tp lot sistem baik lama teknisi lama datengnya alhasil apa sekarang kedengeran suara,positif
review jujur awal masang my r trs tiba2 tawarin wifi perintah awal ragu cmn kasih solusi gratis 1 bulan klo gk cocok copot akhir coba pasang 2 wifi my r wifi perintah nah coba bayang my r 100mbps banding dgn wp 200mbps cepat gk beda jauh bandingin cara livestreaming obs situ tera cepat internet aneh lebih stabil my r tpi wp not bad harga sgitu jauh sekali lebih murah klo misal wp konsisten bakal alih wp,positif
orang kyk pling tau doangg,netral
the next india bravooo indo internet murah cepat is the real ice breaking,positif
kata kunci adik prabowodemi 2029 raup 80 market tiktokers kolong2 kosan kumuh make sense,netral
internet apa indo ngga up tosemua share connection arti koneksi dibagitermasuk provider isp telco up tojd bukan suatu penentuyg penting kuat fundamental trutama dipolitikjng kaya starlink langsung bunuh perintah kompetitor klabakan sm dagang,netral
kaya bolt dulu bolt home dulu radio,netral
kait radiasi sinyal aman bang,netral
pre registrasi sukses hingga kini konfirmasi surge dah ribu pre registrasi tahu ter realisasi,positif
website error cuy,netral
abang presiden adik menang lelang jaring se jawa udah aneh wkwkwkw,netral
paling cuman omon omon,netral
masalah kapan rumah,netral
nah pribadi moga jalan lancar internet murah balidsini terlalu kabel optic biaya mahal tp ping besar bngt,positif
kata kunci menang tender perintah,netral
kata kunci tender abal abal,netral
bro contoh my republik,netral
hadeh hadeh terus mau,netral
kacau,netral
starlite bang surge udah operasi duluan fiber optic 100k 100mbps udah ngepasang daerah udah jangkau,netral
halah bawel emg jg diuntungin konsumen biasa kicaun psukan sakit hati sllu smpai modarkasian,netral
kasih murah cela kasih mahal apalagibinggung,netral
jangan naif,netral
tender abal abal,netral
contoh pikir sdmrendah,netral
emang benar sengaja menang usaha adik prabowo 20 tahun kuasa sekali kuasa lamgsung proyek,netral
kakak presiden arti adik menang lelang gitu,netral
bilang siapa jangan menang lelang bapak presiden terus sampe ngubah konstitusi negara anak kurang umur anak wapres,netral
awal pesimis mafia internet nyata rencana bukan usaha abal abal,netral
dah daftar nunggu thn depan kayak apa,netral
provider pasang paket data 28 hari praktik kartel,netral
kerja bagus transparan jujur bagus kampung sekarang udah internet 100rbbln speed 510 mbps langgan sering sekali ganggu,positif
mirip mbg proyek nasional keluarga jabat,netral
prcaya proyek perintah buat rakyat,netral
butuh konsistensi saat langgan jibun sejarah perinternetan indonesia kenal gimmicknya,netral
jual murah untung cari untung nga gila mark up lapor investor apa mahal konoha gratis suara toa peka telinga,positif
internet indonesia memang gila buangett udah mahal leleeeettkayak pulsa masa beli rp 100 ribu kata bulan eh blm jg nympe sebln dah drained,negatif
solusi buat internet rumah provider seluler tetep dpt pasar ponsel win2 solution provider seluler usah serakah monopoli pelit busuk,negatif
do opposite from government said citra,netral
ga kaget kl bohong kan sdh ajar guru 10 thun lalu esemka krn kkn jadi proyek sebut,netral
untung aku duk malaysiawalau line 4g speed 170mbbayar rm75 sebulankota 1tb sebulanbaca komen speed internet indosungguh sedih,netral
aneh telkom tahun tahun kuasa pasar mulai indonesia layan jelek kualitas jelek padahal harga mahal mending telkom bubarin biar swasta saling saing undang usaha luar negeri biar saling serang antar swasta biar murah layan baik,positif
gpp after effectnya salah satu perang harga telkomsel lebih murah,positif
mbg awal skeptis check realitanya kualitas makan baik banding awal laksana racun serap tenaga kerja serap bahan bahan makan inti putar putar ekonomi lebih kencang lalu kemaren baca perihal fwa masuk ide brilian jadi masuk akal harga bakal 100rb emang minus bakal lag jam padat tambah purbaya ngucurin likuiditas bank nyata pak wowo ngk omon omon doang,positif
apa gimmick udh nyoba daftar coba dulu jangan nethink balas buru buru alih starliteviberlink karna 1 grup lokasi jakarta timur bos cek diaerah sini ngomong 100 benar omong kosong,negatif
klw lihat program2 baru perintah jalan skrgsy pribdai pesimis jangka panjang,netral
satu kata pantas utk murah hidup indonesia,positif
telkomsel sangat kecewa udah mahal jangkau wilayah jauh indonesia,negatif
btw rel kereta deket rumah tambah kabel tiang selalu tanya tanya fungsi kabel,netral
