text_stemming,pseudo_label
bagus banyakin provider masuk plosok terlalu lama indigo kuasa usaha rugi terus sekarang mampus udah lelet mahal fup tambah odp penuh terus gada tingkat,negatif
tpi indihome tetep stabil jga,positif
internet rakyat daerah sykabbatang jateng wifi murahkalau salah covid internet murah itubiaya pasang gratisbulanannya 100rb cepat ky wifi bulan 350rb,positif
jaring aman info aman mata database negara bakal obral,netral
harga internet fiber optic malaysia100 mbps rm 100 per bulan300 mbps rm130 gratis tv 42 inci500 mbps rm 150 gratis tv 55 inci kontrak lama 2 tahuntiada bayar pemesangangratis,positif
gimmickhoax masal,netral
kayak bobos tak jelas negara kocak,netral
masalah komponen biaya internet broadband indonesia mahal biaya ormas biaya oleh tetap kabel internet pelihara jaring infrastruktur internet pasang kabel internet rumah investasi bangun kabel fo mahal situ kasus biaya ormas biaya izin birokrasi beberapa wilayah wajib bayar ormas birokrasi enggak potong rusak kabel guna internet isp arus utama keluarga guna surge komentar surge memang murah konsistensi stabil jaring memang jadi pr sendiri surge internet sering putus siang hari lepas maghrib smart home saklar otomatis lampu cctv kerja guna internet isp arus utama masalah internet langsung tangan serius isp mungkin menteri komunikasi digital bekerjasama menteri pu perlu bangun jaring terowongan utilitas bawah tanah khusus tanam kabel internet listrik rapi minim ganggu kurang biaya komponen internet beli tiang telekomunikasi,netral
bagaimana dgn dana korupsi ratus triliun triliun puluh triliun buat akses internet,netral
sy solo masuk kota besar 20 mbps 100ribu ngimpi sekali cari jual segitu,netral
saran buat starlite internet rakyat gausah gede2 takut gabisa penuh benar perlu 100 mbps anda 20 mbps udah bagus penuh guna hari mayoritas masyarakat,positif
brp lot,netral
waduh iya,netral
telkom bukan kalah ngalah berani lawan adek presiden jabat copot,netral
internet 81 ribu per bulan prepaid plan4g 200gb5g 2000gb borneo sajamalaysia timur telco u mobilemau pusing pala starlink mini,netral
tau ownernya hashim w langsung no ingat guys jangan pernah percaya oligarch bisnisbisnis mungkin murah data jual sadap,netral
good luck buat cs kerja sana,netral
bagus tambab kompetisi lihat bener nggm cepek ceng doang jangan2 biaya siluman kaya starbakkeling biaya padat,positif
pertanyaannyakenapa bikin internet rakyatbukankah pln icon net,netral
ingat dulu pernah xl bebas beli kartu 15rebu internetan puas nomer tenggang sayang jaman buat main fb doank,positif
pesimis sekarang daftar jelas,netral
kerja provider plat merah tanda2 counter internet rakyat inipadahal dulu masuk myrep sempat brifing rasa internet rakyat ancam provider fiber d silah koreksi,netral
harap beneran desa butuh internet kayak gin moga thn depan realisasi,netral
buset dah koh sfx risernya overuse si maaf tp nyaman nontonya padahal aku suka nontonin konten dulu tp sfxnya overuse koh mon maap buat editor,netral
outlet kecil pinggir jalan gimmick scam mirip2 bobibos pertama mesin wfa blm rilis resmi user suruh daftar dulu mungkin yaa klo daftar eksekusi klo dikit eksekusi data update data pribadi tau sendiri indo orang peduli data pribadi ntar buat senjata pas milu buat naikin popularitas tau wfa pakai sinyal bts 1 bts sewa provider 15m gunung sedikit duduk 2 m lebih area kota prediksi pakai nebeng bts xl smart,negatif
ay man you dont need to censored the swear words,netral
si merah ngaku fiber optic hujan jg stabil,positif
moga indonesia depan lebih kembang,netral
internet rakyat pasang xxxstarlite harga udah pasang,netral
buka lapang kerja orang orang gaji gdp tumbuh,netral
telkom rumah dulu wifi id home 50rb lalu mati emang negara aneh telpon umum hilang pdhal negara tetangga mas,netral
tetep skeptis bener alhamdulillah,netral
metode salur internet kayak internet rakyat udah 4 tahun lalu,netral
bukan data hari bocor,netral
beliau lucu sekali,netral
ooohhh emang sekarang jual sadap,negatif
serius,netral
emang admin jaring sekarang siapa pegang,netral
punya mas elon,netral
dftar dr agustur blum ad kabar,netral
kayak antridi tempat ortu pasang sejak 4 bulan lalubayarnya pasca bayar pakai dulu baru bayar bulan depannya100rbcuma kata kadang sering ganguanyo wis penting murahwkwkwk,netral
praregister dulu jaring bakal bangun sekarang perlu sewa bts tower udah jaman sekarang lebih bangun pinggir jalan pipa tingi cuman 6 meter an,netral
tiang kecil 6 meter kan wifi kabel berijin,netral
ga moga moga moga perlu modal mikir boss facefuchsiapoopshape,netral
terus pajak lama,netral
betul klo ngangkat internet murah tp lapang kerja tetap tumbuh yaa kurang sip,positif
wifi scam,negatif
tpi brrti perlu nunggu pancar bangun dulu masing2 tempat,netral
ingat 1400 100 mbps alokasi 400 guna singkat trafik sedang padat mungkin dapat maksimal 2mbps sendiri pakai dapat 100mb layan broadband up to,netral
mending omm elon musklove u elon,netral
klo mau stabil tetep stay fibergue bayar indihome 350k 50mbps fup 1800gb woth it ajatpi pgn coba internet rakyat lgsg bandingin kualitasnyaklo rasa lbh hemat speed stabil pelan2 indihome stop,positif
daftar kakak starlite tanggap cs jg ampas padahal masuk jangkau follow up sekali andai 1 calon lewat sales buat starlite semua tanggap,netral
klo basis wifi buat main game auto misuh2 apa wifi tetap wifi main fighting game auto ku deny matchmakingnya its asss kayak hape fiber ngadat2 wifi packet losssaya sendiri nggunain indihome 5 taun henti gara2 speed upload download simetris masalah2 rutin lain padahal bumn pindah provider swasta malah lebih murah damai ganggu,positif
ekspetasi orang miskin minimal dapet under 10mbps udah sangat cukup 100rb bulan 10 mbps udah sangat bagus,positif
gak percayaada jadi luar sdh lpinternet geratisbanyak ttp bangkrutending nyajualan cok muahal,netral
cek lapor uang surge 23 tahun belakang mana revenue streaming besar berasalinvestor jepang ntt softbank kenal sangat teliti uang investasi ntt benarbenar masuk lapor uang surge baru upa ceremoni ajahfaktor local strongman mgk buat ntt masukvendor surge minta sedia alat titik odp fwa rumah2dengan share revenue 8020 surge 80 vs vendor 20 harga 100ribu itubagaimana nanti internet speed muas langgan akhir langgan putus henti siapa tanggung rugi yaaa vendordi sisi lain arti surge asset masif keluar modaldan cantik lapor uang valuasi company nyabuuummsiapa untung pegang saham utamanyabarubaru surge dapat pinjam bni hampir nila 1t itung2 tahun mgk bunga bayar 100m operating cash flow besar bayar bunganyacek bagi transaksi pihak relas related party transactions pinjam 1t bni guna belanja modal capex vendor pihak tiga independen alir usaha kontraktorsupplier milik afiliasi pegang saham utamakapan indonesia timur misal papua terima layan fikir waktu dekat mungkin dapat revenue ceruk pasar niche pulau jawa inijika banding jio india rasa apple to apple knapa belakang jio konglomerat reputasi kelas duniaestimate exit strategi apapanjang cerita amat cerita jauhsambil seruput cangkir kopi,netral
last mileprnah proyek lg,netral
btw tempat w udah tengah warga daftarkhusus rt rw lurah gratisdipotong biaya operasional warga,netral
lebih curiga data masuk lewat provider group megang orang perintah sorry to say percaya perintah ntr klo ngoceh2 apa sosmed langsung tag orang tiba2 ilang apa rem tuh,netral
moga sukses suge ujung masyarakat untung,positif
kuota injek lumayan lebih murah fo,positif
terima kasih,netral
sini 10mbps 250rb,netral
tetep fiber optik harga kualitas,netral
eak saham wifi ancur lebur bawah kubur,netral
mantap analisis korups halus lg,positif
cuman analisa iseng ajah hampir tanya atas jawab sendiri temu jawabannnya benar jugadan simpan beberapa tanya lainnyakalo sampai sosmed spt sopan pertanyaan2 jawab sebut hubung satu lainnyaconnecting the dotmaka fahambahwa korups analisa mungkin lebih legitimate financial engineeringterlebih tahu siapa orangorang belakang layar,netral
misal warga butuh internetbisa ruang tamu rtrwlurahdan mesti wifi pribadi,netral
lama bukan ras bukan bas fitnah aman2 kokindonesia salah satu negara paling bebas dapat,netral
pt anak prabowo kan flashback soeharto korupsi besar dunia ups soal mirip gatau endingnya bakal beda,netral
saing utama isp2 kecil2 terdampakbro tau betapa brutal bisnis internet indonesiajangankan ira starlink diecersempat buat si elon panikmasyarakat bawah grass root bukan manusia2 bodoh manfaat sempat dapat uang recehmereka berantas bukan utk waktu lama1 berantas muncul 100,positif
forum tetap broadband pakai fiber bilang stabil entah usia kabel pasang fascon kurang bagus wirelessya mirip nembak wifi tetangga pakek cpe angin angin customer rw net pakek cpe tiap minggu ngeluh mulu padahal harga 100rb,positif
atas kertas 100rb sbelum kena punglistelah turun k lapang kena pungli wah rugi 100rb bikin 500rb lahstarlink niat mw ngasih internet gratis korban banjir d tengah jalan d todongkatanya,positif
musuh besar pimpin very small area aku baru tau ijin suatu provider suatu daerah ttd ketua ketua area terus ketua area dpt cuan mau ttd ijinnya tangsel kota asa goa,netral
bahas starlite bang,netral
ujung keluarga main,netral
temen udah langgan satu bulan pertama trial bulan depan baru bayar speed 200mbps diutamin jalur kai,netral
benar wujud sangat bantu laku umkm misal dagang makan bas online daerah susah sinyal biaya internet 100rb bulan,netral
rtrw net bakal gulung tikar go go wireless sikat habis mafia telekomunikasi,netral
teori fisika frekwensi relatif rendah 14 ghz panjang gelombang lebih lebar daya tembus relatif lebih kuat walaupun paket energi relatif lebih rendah rakyat penting murah praktis internetan masalah lain mikir hukum fisika efek fotolistrik atas,positif
telekomunikasi sampah dunia sini contoh telkom internet data tiap langgan beda2 harga uda tiap bulan beda2 usaha komunikasi negara paling sampah prnh kualitas biasa main harga ngotak,negatif
betul makek starlet alhamdulillah nyamanpe sekarang lancar,positif
lebih baik starlite pribadi guna internet rakyat,positif
indihome tiba2 naikin speed internet 75mbps tagih,netral
ingat bolt mirip jaring,netral
wah sumut maling tu rel serta kabel optik,netral
saat ekonomi sulit paling penting harga murah titik,positif
akhir paham wifi naik parah moga eksekusi bagus hasil beri internet murah bagus lebih masyarakat indonesia,positif
blum putar video namanyaterkesan unsur nasionalis insting udah arah dluan konglo lingkar rezimsambil nyelam minum air latah nama program sekolah rakyat koperasi merah putih entah depan bisnis apalgi muncul lingkar orang tersbut lama pandang masyarakat batas komoditas,netral
starlite bahas,netral
karna dikit maka bang segitu tp penting murah,positif
orang bodoh paham efek negatif banding provider umum,netral
starlite 2 bulan no info kasih tau progress bang padahal 600m stasiun,netral
250 y bang,netral
tinggal lompat pasti murah internet rakyat tangguh tahun udah cukup memporakporandakan pasar internet mahal mau mau ikut saing turun harga internetnya,netral
beda telkomsel indosat dgn apa,netral
bolt kaya esia flexi fwa telkomsel indosat selulerfwa arti jaring dikonci buat satu lokasi misal esiaflexibolt buat kawasan jakarta dipake bekas,netral
indosat telkomsel butuh bts lebih frekuensi jauh lebih tinggi,netral
ngeri dukun satu coba ramal ajal kapan,negatif
jahat orang,netral
ajal kapan,netral
jujur internet 100rb bulan sangat masuk akal rumah internet 150rb bulan cepat batas tp anggota keluarga cukup dar chat youtub game milik internet lokal kelas perintah 100rb bulan sangat cuan seluruh wilayah indonesia kata misal untung dikit tp langanan unjung2 untung,positif
scam turut grub fb telegram kaya bolt duluditambah urus speed nama upto faktor sinyal jugaada ngeshare badwitnya 1gbps bagi 400 user tinggal itung masing berapasama tambah starlite emang bayangin 100kk 150mbps lebih,negatif
lihat indosat telkomsel bulan 30 hari bukan 28 hari,netral
murah mau sinyal enak kwkwkwkwk lawak bang,positif
dipikir2 oasis tengah provider2 internet ngasih kuota dikit 28hari udah normal guna nikmatin internet unlimited legal ini pasar data guna bakal aman tau,netral
myrepublic 500mbps jitter naik turun dikit patah patah pas zoom wlan,netral
pd jaman sby telkomflexy unlimited rp50rb bulan 300mbps aka 300kbs,netral
cpe 4g enak lho pakai kuota besar xl sabar nunggu 5g,netral
446 youre welcome,netral
ah lebih murah pasang wifi bayar bulan 50k per hp,positif
tbh rumah golong target market masuk guna data moga eksekusi bagus,positif
buat total monopoli pasar takut bakal total monopolikita tahu pertamina monopoli pasar bbm kualitas takut malah kaya pertamina,netral
udah 1 bulan lalu daftar responnya samsek,netral
jabar masuk,netral
produk surge satu too good to be true free modem unlimited upto 100mbps gratis bulan pertama 5g segi teknis uang besar buat bangun infra pola org indo yakin tarik mata sesuai ekspektasi toleransi tinggal ikut nasib net1atau marketing buat goreng2 saham wifi biar ketemu dssa dcii mlpt atas sono tau,positif
waduk medok,netral
harus kompetitor mau saing kualitas ditingkatin murah plus cept ngga yekan,positif
nonton ko ngelag,netral
pernah coba tempat kawan lot emang 100 rb klo tempat kayak wifi ilegal 100 rb an klo pas hujan petir mati,netral
sekarang lg nonton pke internet mur 100 rb alhamdulillah lancar jaya,positif
untung 10ribu satu rumah berapa juta rumah pasang untung korup si,negatif
gantung pulau provider internet bbrp pulau khusus jawa udah usaha ginian indo timur mungkin monopoli untung klo hasil but geografis wilayah challengenya klo surge hasil pecah masalah internet patut apresiasi pulau2 menang tender proyek myrepublickok tau gara2 kecimpung ihsg org ihsg udh pd tau duluan soal intern rakyat emiten antek2nya,netral
udh nyungsep tuh,netral
tp bro,netral
tuju target orang desa pakai rtrw net emas ratarata buat nonton doang ibuibuanakanak bayar 150k dapet 515 mbps up to nyampe 20 mbpsbegitu internet rakyat hadir 100k dapet up to 100 mbps bakal ledak informasi mulut mulut desa kenceng lihat eksekusi rapih lancar pindah good luck buat eksekutor,positif
bagus skema internet rakyat rumah terlalu padat duduk padat bagi bandwith jaring akhir lot,positif
seperti scam udah daftar bulan lalu sampe skrng konfirmasi baik via email tlp,netral
starlite sendiri komplain sekarang rebut bandwidth,netral
udah 3 provider besar indonesia xltelkomselindosat walaupun mahal kualitas bukan main2,negatif
udh terlalu sering rakyat cm komoditas doank mending waspada default jabat aparat maling dadak baik sedang makar buat ngerampok harta rakyat,positif
nethome starlite udah segitu bukan bisnis,netral
755 kaya bagi sini tebelin ulang2 24jam,netral
korupsi kayak,netral
hoax internet rakyat sampek skrg ja media liput lapang layan internet rakyat,netral
mnrt ane gimmik doang berani gin pakai plat merah kelas starlink kena regulasi tekan,netral
ah paling bang manis awal lot akhir,netral
daftar online minggu datang teknis,netral
starlink gratis lokasi bencana perintah bingung siapa bayar pulsa padahal bilang gratis,positif
sempat saham harga 300an,netral
narasi loncat sana sini,netral
gimik mustahil perintah mau hilang uang setor operator indonesia liat jangan percaya omong perintah starlink gratis lokasi bencana eh bilang siapa bayar pulsa tai2,positif
kaca proyek mbgtempat bancaan korupsi jabat,netral
jadi the brilliant inovasi kayak qris bubar kayak blt we will see,netral
016 eyy yoo chill,netral
desa udah 200mbps kata kenyataanya lot udah 1 bulan uji coba gratis ngeluh dgn cepat,positif
make orang internetnya cuman asal satu perangkat doang percuma jadinyasedangkan kampung berapa orang benar solusi perintah jangan cuman ain 1 internet doang,netral
duh sakit perut denger takut kaya gin internet rakyat,netral
klo jkt lumayan lot pakai lg nonton yt,netral
internet kran pipa air bang sistem belakang dukung bagi rata buat ragu eksekusi sendiri andal vendor 3 nyata hanya laku rt rw jual internet legalitas jelas makanya waktu tawar tolak handle kerja starlite terlalu fishy too good to be true kemudian modal tahan berapa lama capex opex infratruktur jaring mahal sekali lelang frekuensi habis panjang mana nutup jual 100rb,negatif
rj9uo jual model mbg bang penuh dgn drama politik,netral
republik 10mbps lama cek cepat tingi tembus 270mbps enak download 1gb kurang tengah menitsekarang tiap hari cek kecepatang rata angka 200mbps 110rb,positif
mantap bro tkp mana mau pasang tercover,positif
my republik bang,netral
cara kak,netral
apa bnr segitu bs cepet,netral
paham satu banding 400 up to,netral
anggap pipa utama keluar 1000 bagi 400 langgan bagi rata jam padat dpt 25 mbps blm masuk halang interferensi cuaca sepi mungkin baru 50 langgan langgan dpt 100 mbps awal lancar terus beberapa bulan ikut lot arti pakai alokasi 1000,positif
up to 100 mbps 1400 udah confirmed,netral
waktunay beli saham wifi,netral
starlink emang enggak pakai listrik nagih pulsa padahal internet satelit laku ormas emang beda,netral
makanya harga lambung tinggi faktor 1 biaya beacukai tinggi2 korupsi tinggi3 harga distribusi subsidi tinggi4 olah anggar terlalu tinggi,netral
diskon besarbesaran saham,netral
daftar pre regis bulan november awal wa bneran apa hoax sebenernya,netral
tarik daftar,netral
sumatra kapan apa sumatra indonesia,netral
buat ane bukan gimmick bandwidth singapore bukan ambil kabel sekarang akhir harga tentu harga sewa kabel,negatif
telkom tydak syukaaaa,netral
gretonger,netral
cukup guna kaum miskin tani pelosok moga tahan lama muda akses,netral
gk peduli soal internet provider gulung tikar mahal penting ekonomi konsumen maju bukan gelontor orang2 internet provider,negatif
speed ny sampah,negatif
depan internet gratis kaya udaraangin,positif
504 ragu izin ormas hilang pernah jadi orang mau ngerjain pelihara rutin tower jaring malah dimintain uang gerombol simpanse,netral
apa hubung jual beli data amerika beberapa waktu lalu viral,netral
kelas negara kelas si adik prabowo takut pungli lokal wkwkwkwkwkwk memang susah,netral
udah daftar murni pgn tau scam or not i think i will trust this timeselama warga abuse guna internet murah jadiin rtrw ngerusak uplink sumber,netral
moga internet rakyat pukul ispisp lot mahal soal internet indonesia banding negara asia sangat miris,negatif
klo emang hasil alih rawan negara kayak cina search awas ketat kasih minus social kredit klo macam2 masuk presiden pejabatkayak buat meme tau sendiri bekingin adik si prab,netral
bagaimana dgn tingkat radiasi,netral
paling sering bottleneck bukan backbone keluar sentral tower user,netral
serius mau nyenggol usaha adeknya presiden background militer memang preman gilagilanya rasa banyak logika jalan haha,netral
logika wkwkwkwkw,netral
gausah ngarep beking u siapa dunia kaya presiden,netral
perlu bangun infrastruktur tower kabel fiber backbone sendiri cukup numpangsewa sedia tower ex tower sama lanjut tinggal install modul radio tower tsb on,netral
koperasi merah putih survei eksekusi awas tni lumayan ketat utk proyek perintah sekarang kurang ormas2 jelas,netral
nah perlu ordal negara becking,netral
tenang rab kan udah itung biaya gitu2an,netral
presiden ormas,netral
tp wowo keluarga backingan ormasnya grib hercules ormas mau malak dgn alas akamsi apa mungkin pikir kali pp fpi ormas suka bikin keras hitung untung rugi mau bentrok dgn hercules,netral
gk mungkin kn prusahaan swasta jepang mana kontrol aset sembarang kn cma kerja bangun infrastruktur doang,netral
usa sendiri bohir teknologi spt meta gugel dekat perintah usamrk guna sempat industri jasa teknologi usa paksa byk negarakalo perlu pakai ancamanlihat sendiri tiktok jual krn trump butuh ttmedia trump ts terlalu lakuorg buk utk tahu apa narasi trump hampir tiap haribisa isi ngomel2atau nyuruh org2 segera jualbeli saham digorengpokoknya 2 minggu trump bikin sensasi,netral
terlalu over thinking brok gitu kali peluang hasil besar tp kan pilih range 100k indihome biznet range segituan tinggal bijak2nya milih buat butuh elo,netral
daerah udh masuk starlite fiber optik emang real malah 200mbps 100rb udah jalan 8 bulan,netral
liat vt layan parah bet suruh sabar tpi gaada hasil harus dibenerin lgi sistem biar ntr kerja g bingung nungguin pusat sana kasi jir maki gitu,negatif
lemah fwa okupansi tinggi cepat turun,positif
baru kemarin mertua ku pasang wifi,netral
betul sdh otomatis sy salah 1 langgan,netral
wifi hari arb bang,netral
haya 100kbulan 5 hp,netral
desa sekarang tiap rumah udah pakai wifi tau jaring mana wireless apa udah pasang pancar pancar titikrw rumah ku ada modem adaptor bayar 120rb per bulan kayak mirip internet rakyat bikin ngakak jaring lot orangtua tetangga ngomel ngomel banting modem mau ganti kabel sendiri mau ganti adaptor sendiri gila pd rewel ancam ganti wifi memang sering pasang wifi desa 3 orang lot langsung ngelabrak tukang wifinya ancam ancam ganti wifi satunyaposisi jateng,netral
klu internet rakyat bener bagus kualitas bagus stabil jamin bangkrut klu bener mau pindah,positif
bagus paket internet murah penting user paham pasti kualitas fiber jawab proporsionalitas user bayang user rumah tangga hari2nya butuh dar komunikasi sosmed bayar tarif fasilitas bisnis sayang duit bisnis mau ikut2an internet rakyat jangan komplain sesuai ekspektasi salah sendiri tarif murah mati kompetitor spt acer ngeluarin produk laptop murah pabrikan tutup milik segmen sendiri2,positif
modem wifi kabel modem portable terus smartphone khusus mungkin sim cardudah jelas arah tunggu,netral
yg penting eksekusi dijalanankan benar amanah akal akalin biar vendor instalasi dapet sripilan harus bagus karna engginer harus maping ngatur baik instalasi standar alat apa,positif
oy wifi rumah wifi perintah khusus daerah dekat rell kereta cmn 100ribu bulan org pd percaya satu beberapa komplek rumah pd kasi bnr kalian wifi murah,positif
adanjuga desa dpt harga 60 rb masuk iur sampah sangat posible asal cost infra narik fo nutup 3 4 thn,negatif
senggol pak ono w purbo,netral
scam mah,negatif
dukung impactnya bukan guna ira asa harga kuota murah riah tau sendiri kan kuota makin sini makin mahal 28 hari hangus sisa kuota fair,netral
gimik nasional omon2,netral
nah akhir bahasgw ragu mau daftar krn hp blm 5g and ragu krn program perintah,netral
tp dulu bang buat nntn laen 2 facebluesmiling,netral
tragedi oktober kemaren jadi profits langsung nguap,netral
tetangga ku baru ganti tukang wifi satu tau asal jaring merekperusahaan kata lot bayar 120 rb jaring mati mati rmh ku tadi pagi baru benerin wifinya habis kena petir tadi mlm memang rumah ku kayak jalur petir petir deket,netral
xl udh 21 hari sekarang,netral
makin ngelunjak nyata operator2,netral
yg komen aneh mending nonton jagat review dah udh dijelasin kayak gmna cara kerja minimal jdi rakyat jangan menye doang,netral
biznet ikut 31 free 60an mbps keitung 150kbulan minim ganggu harga stabil mungkin bakal pindah kesana mungkin biznet turun harganaik cepat kaya pas starlink,positif
fup aman2 ku,netral
cuman dijawa,netral
sedang mode survival duli penting murah,positif
usaha om ujung ujung tetap untung,netral
mbg muncul program internet rakyatsaya optimis si wlpn kendala dilapanganuntuk orang desa sangat manfaat harga memang murahsemoga realisasi,positif
jangan pernah percaya layan website companynya kyk sampah paling dasar dapat infomasi kyk mau ngurusin customer service,negatif
better to lower our expectation imo enggak meski hasil gk sesuai dipromosiin projeknya jalan gk bakal terlalu kecewa ujung rakyat untung entah perang harga ato akses internet lebih gampang it still seems too good to be true for now,netral
sumbangsih ormas jg yah arti makanya internet mahal pantesan ormas makin jamur setor,negatif
100 rb 50 mbps aku sudi sini rata2 orang kampung harga wifi 180 rb cepat 3 mbps,positif
daftar susah kaga,netral
bnyk pesimis sini tetep optimis maju indonesia,netral
dukung internet rakyat soal ngerti internet butuh dasar buat orang,netral
aku udah langgan biznet,netral
ide bagus asal eksekusi jalan sesuai rencana awal masalah project baru peluang korupsi jabat remainder project telekomunikasi belum korupsi moga korupsi ulang project lanjut aamiin,positif
daftar mas kabar,netral
hari saham wifi arb ko,netral
jakarta viberlink harga 100rb jgup to 200 mbpskita rumah udah masang lumayan stabil pas hujan,positif
bukan berhasilpasti hasil,netral
tukang download,netral
udah bilang jawa malu papua,netral
internet rakyat bukan proyek perintah swasta gimmick rakyat biar gmpang marketinga utk org awam lewat polos kyak bpack cntohnya,negatif
tsel 0mb 10rb,netral
emang masalah,netral
rp 400 permbps asean vs minimal rp 5000 per mbps indonesia,netral
entah cepet cepet sekali daftarin temen hp masing masing cepet langsung masuk,netral
pesimis bukan arti serah,netral
harga paket internet si merah si biru kena kurleb 100k an 20 gb gila harga kira umr sini 500jt bulan kali harga mahal speed 1mbps nyampe sampah,negatif
yakin teknis mungkin 100 ribu up to 100 mbps kata kunci up to jam sepi yakin 100 mbps jam padat turunbalik nama internet murah overshare bandwidth mau stabil jelas dedicatedtapi patok baru internet bulan harga 100 ribuso sabar mau coba pengalamanya mayan load balance biznet,positif
ap krna indosat skrg susah sinyal,netral
dikonoha buat biaya investasi mahal setor ormas lsm okp ps tempat kepala daerah tempat makanya mahal biaya layan umum baiuk jasa maupun barang,negatif
info daerah udah udh kokdi rumah udah masang tahun lebih langsung pt telemedia nama viberlinkemang harga 100rbbulan sampe sekarang awal masang gaberubah harga,netral
dr bahas tadi kayak ngak guna kelas tegah atas sangat ganggu aktivitas menurunya speed jam sibuk kayak sinyal radio dulu tahu 90an gagas prof onno w purbo buat interner via gelombang radiodan beliau sempat periksa kopkamtib zaman kelas bawah mungkin terima pangsa pasar sangat luas,netral
towernya trouble kena petir internet 1 kawasan kena ganggu,netral
too good to be true infastruktur you know ngasih harga se kompe bit rate se besar nunggu info lebih lanjut,netral
