text_stemming,pseudo_label
internet rakyat proyek hasim adik prabowo dpt proyek program strategis nasional ayo berani gk media tv bongkar kasus bagi2 proyek jgn berani bikin fitnah keluarga jokowi,netral
the next esemka beda nnti lot,netral
internet rakyat ujung2nya kaya bpjs rakyat daftar duit buat funding duit buat saham inti negara gitu2 funding terus merugibiar profit alas rugi apa korupsi pdam plntelkombumn alur y gitu2 ajabai pmerintah internet basis liabilitas baru pdam pln internet butuh mutlak orang indonesia,netral
kayak tau omon2 prabowo soeharto tau langsung suruh talak 3,netral
udh daftar smga segera laksana yaa internet rakyat,netral
abis jawab gitu temen langsung ikut daftar,netral
bolt,netral
kuota mahal wifi mahalkita dukung internet rakyat,negatif
jujur dapat pribadi sanksi internet rakyat bakal seluruh indonesia,netral
percaya tida kampung sayah udh wifi microtik sayah pakai wifi percaya percaya speed mentok 200ks,netral
menit 4 indihome bohong,netral
mulai rakyat rakyat nihhhhhh tinggal uuhhuukkkkk uhuukkkkkytta wkwkwkwkkwkw,netral
sekarang blum jelas padahal udah daftar,netral
tuju tuju jelas biar provider sepuh mau introspeksi sadar diri udah tinggal jauh negara tetangga ngga alibi susah infrastruktur negara pulau ciriciri ada zona nyaman mau kembang lama cuan alir,netral
ken lebih baik turun harga hardware pc soal bbrp hardware goreng harga,positif
bagi 2masyarakat biasa masuk area internet murah inimasyarakat elit broker usaha konten creator alih starlink lebih praktis mobil cepat esklusifitas,positif
knp malaysua thailand murah,positif
cuman muncul internet komentar sana sini bangun negara bejuang barengjangan cuman andal pemerintahkalau rasa paling hebat benarcoba bukti cipta lapang kerja upah layak jangan bisa cuman koment sajabantu aparatur rtrwdesa camat kerja masyarakat,netral
bisnis jaring sdh terap sistem harga jauh lebih murah pakai sistem wireless akses point beberapa titik beda konsumen perlu pakai alat router rumah langsung koneksi aksepoint bts outdoor saat guna masuk area rumah lgsg koneksi wifi lama area rumah cons alat pakai wifi 6 aman hujan perlu tahu wifi6 sdh suport ofdma walaupun signal 1bar akses internet ping kecil akses point dekat maks per radius 40m rumah sekala 5 hektar butuh akses point 30titik biaya mahal tp tidur nyenyak,netral
internet mahal cost operation usaha telekomunikasi indonesia terlalu tinggi tekan campur tangan birokrat sgt kental nama korupsi,negatif
percaya sumur baru jebat timba korupsi banyak banyak,netral
wajarin aja beliau keluarga lama tunggu moment kuasa jalan usaha,netral
iyah sekarang kadang ngerti aku baru ngisi pulsa sekian puluh ribu asi wify kontrol tdi tau tau pulsa tinggal 0 padahal lama pernah nelpon keluar rumah terus sisa kuota gk kepake wify terus kuota rata2 5 gb atas angus sendirinyakemana untung propeder,netral
main cantik kakak presiden adik jaga gerbang,netral
internet provider tulis up to mau konsisten biasa bayar 1 juta buat 1020mbps stabil,positif
starlink no1 dunia langsung dr satelit,netral
lelang tender tiap wilayah denger jelas tadi pipa besar jalur rel kereta mungkin jalur tunggu lama pakai sistem tembak antar tower alir jangkau pelosok entah tunggu realisasi,netral
lihat samping rel kereta tihang tanam rawan kabel kena rubuhan pohon,netral
tldr seluler deliver satisfying bandwidth unlimited harga murah jangan terlalu ngarep1 internet 62 ampas ispnya kikir dukung alas basibin ngibul bosen2nya dipake geografis kompleks padahal jakarta udah server macem2 google meta aws cloudflare microsoft jaksel area elit speedtest index 49mbps bawah chattogram 55mbps kota biasa bukan ibukota bangladesh seribet apa coba geografis jakarta 2 estimasi biaya last mile fo 152jt per rumah salah kata last mile kota fonya rata2 aerial gali2 perkara pasang tiang pusat taro oltmahal emang 1 unit service user 1 strand fo narik 128 user kabel tebal antar tiang isi puluh core fo 1 roll 12km jual bebas harga bas juta narik kabel odp lokasi paling modal 50rb perlu lebih panjang user tambah bayar ont kata brandnew 1 juta ini tanda tanya sekali tarik lokasi perlu ingat fo service 1gbps lebih up teknologi mesti ganti kabelkedengeran ribet rtrwnet main fo bulan miring ambil bw isp besar cerita isp besar ngeteng murah inget rtrwnet beli bw isp paket internet margin wes3 soal tx fwa da nanya bts seluler ngasih service samacomparable fwa 14ghz 4g 09ghz 18ghz 4g 62 ntah kapan2 narik 100mbps boro2 unlimited teknologi fwa goib sekali bilang tahi kerbau heran backbone jalur kereta satu sisi emang bener jarak dekat sisi kan kerja baru udah narik fo antar kota sedia dark fiber emang uang monggo jangan2 ntar habis duit backbone tau backbone bawah rel kereta ntah apa masalah nanti4 jio emang teknologi fwa kaya engga arti main marketing bukan perkara teknologi internet 100rb 100mbps turun harga internet nasional mungkin cara paling bener intervensi perintah langsung oprek harga pasar regulasiberpangku tangan fwa buat turunin harga internet realistis tech specnya mayan goib panjang depan stay eks mujur tembok halang fo buat jual murah bom sensenya hancur fwa main,positif
gak usah sampe cepat 100mbps 3050 mbps gpp asal harga 50100rb unlimited jg dukung,positif
telkomsel ping besar mahal babat habis sisa pulsa lupa paketin internet gelo emang,negatif
prabowo presiden segera laksana internet murah cepat stabil kamu muda gen z milenium mau cobos prabowo nepalindihome myrep kalang hore3an youtube facebook tiktok instagram cocok ngakses server amerika eropa sering masalah stabil ping tinggi,positif
ingat jangan pernah bisnis perintah,netral
tdk percaya dgn pemerintahaan rezim ngibul 10th plus lanjut inikabinet busuk isi menteri2 inkompetensiinkompetensi bs lebih bunuh 1000x lipat jahat,negatif
lebih cepat lebih bagus realisasi kuasi starlink,positif
lumayan buat nonton drachin,netral
udah pasang blm internet rakyat,netral
internet cepat buat apa kata bapack2 tau internetan nonton youtube scroll grup wa,positif
tujuanya sebnarnya biar kalang nikmat faktor cepat satabil konsisten target market beda,positif
indihome the baik stabilitykencengkalau complain mudah,positif
alat politik doang,netral
udah daftar ptg ntr ntn channel raymond chin lancar bufferingkwkwkwkkw,positif
model bolt dulu bukan,netral
my republik fiber 100mbps upto 200mbps 233k bulan kayak mustahil 100mbps 100k bulan,netral
pridator pricing,netral
mengontrolbukan finansial,netral
jaman sekarang percaya perintah,netral
beneran jadi rw net gulung tikar dongkalau misal ngarahnya masyarakat penting nonton youtube sosmed wa,netral
fwa ganggu otak,netral
tempat rame,netral
tanya tanya akhir video jawab kaca reliance jio india 5 tahun muas rakyat india tengah bawah komplain arti,netral
riset kurang rey inidi rakyat kabupaten internet umkm bulan 100k speed 1015 mbps unlimited jugapoinnya betul youtube game lancar buat 45 device 1 keluarga kabel cyber optik titip kabel pln bukan tanahkalo klaim 100 mbps turun 50 mbps hujan 100k bulan bakal ledak,positif
layak beli ken akses internet murah minus tadi konsisten kabel lebih sering lot ganggu wifi kabel fiber optik pilih uang ken wifi konsisten ken hemat,positif
internet rakyat jawa,netral
w wifi rakyat lumayan kenceng wifinyakalo tiba2 mahal tinggal tinggalin,negatif
prediksi raymond bobibos benar sekarang,netral
cepet seru bikin penasaran emang beda,netral
hallo bagus tidak kualitas internet jebak apa perlu pioneer coba lebih dahulukita asumsiterima kasih,positif
hoax prabowo,netral
sedia kota besarkalau kampung jauh rel jelek sinyal,netral
sekali coba langsung ngerti betah,netral
satu bang satelit starlite buat daerah pencil papua malu hubung lalu satelit beda starlink konsumen beli perangkat mahal koneksi satelit starlite cukup modem 5g fwa cukup tugas tangkap sinyal satelit adalag bts,negatif
2 lebih presiden jokowi 1 terus bangun jalan tol 2 orpol jadi kendara lihat 10 kurang 1 bagibagi uang kalang oligarki 2 bangun bandara hantu 3 elit orpol pertama x usung jokowi jg pernah jual pulau 4 beri main sebut pansel2 5 sd,netral
sibuk pakai fiber optik satelite guna apa by flat earth,netral
mau bangun usaha ijin ormas siapa ormas kuasa indonesia perintah bubar ormas hambat ekomomi negaracuriga pelihara penting pribadi,netral
lama rakyat manfaat tidakdaripada telkom bumn rasa lintah darat,positif
hari gin perintah mau nyenening rakyat ngimpi mending nyenengin usaha langsung kantong,netral
memang pegang kuasa sponsor balik ormastujuannya macam2 mulai pantau kendali pribadi,netral
kaya lanjut tp tengah jalan elon musk gila tetep starlink soal desa,netral
to good to be true,netral
0953 aku gamer main game offline steam macam wukong spiderman 2 stellar blade perlu koneksi pingnya rendah cukup wifii unlimited buat downloadnya,netral
paket data bulan laku 28 hari,netral
nyata fwa tohh skip pakai isp biznet home0 biaya 140k note kontrak 1 tahun bonus x bulan pernah manggil tukang troubleshooter sekali jujur biaya beli quota pulsa lebih mahal karna mmg pakai kerja buat infrastruktur rumah latency aman butuh trading bbrp webserver remote server saran calon beli pasti dulu coverage mmg mau beli model fwa bahasa isp up to xxx mbps balik layar 100mbps berapa user,negatif
malas udah monopoli kontrol surveillance,netral
waduhhh mana sya udah prareginster,netral
tanya kalian well iya liat dulu internet aman lancar inti bukti uji waktu yakin kaya india,positif
aku harap internet rakyat kota ku,netral
0433 selalu benar contoh pas kos pinggir jalan raya samping pabrik kabel dilewatin atap perlu bobol tembok kos kos lubang ventilasi paling isp modal kabel fiber optic 10 meter mana 10 meter kabel fiber optic shopee 15 ribu contoh toko pinggir jalan sambung kabel perlu hancurin tembok perlu gali tanah,netral
tp lo tau nama vibernet internet rumah 100mbps beneran 100 rebu,netral
arti mirip publik hotspot akses poin sekala lebih besar jangkau 1 desa aman privasi bahaya,netral
0252 smp ipa ajar fisika tidur tau daya tembus gelombang kuat arti panjang gelombang panjang frekuensi kecil banding balik alias wifiinya lebih pelan frekuensi lebih kecil mirip gelombang radio mana jangkau hingga pinggir kota jauh berkilokilo data kirim sedikit,netral
awal muncul 2 starlite pakai infrastruktur kailebih realistis tp coverage mungkin rata karna tempat rel banyakinternet rakyatpakai 5g wfa butuh bts 5glalu modem jaman dulu coverage lebih mungkin cakup mungkin realisasi waktu dekat bangun bts 4g lamabutuh dana massive 5g udah jelas gimmick akhir periode,negatif
program ganjar pas capres yak,netral
yakin data aman tambah awas perintah,netral
moga cepat jalan projek,positif
ga kaya gitu karna implementasi lapang kmrn aku vendor bawah bangun back bone,netral
pantas netizen prindapan makin eks,netral
akal akal usaha cari untung besar besar bangun sistim digital tak perlu modal besar contoh tv degital kabel pulsa menara pancar terima daerah daerah hasil tv bagus lot tipu daya usaha pancar internet,netral
cakup wilah sempit,netral
beda la bang contoh gampang anggap sinyal 5g lo kartu sim telkomsel emg pakai sinyal 5g telkomsel nah sim telomsel 5gnya ibarat modem router ira nangkap sinyal buat tetring rumah wifipernah orbitsama persis spt terus cara lo sadap pegang router eloyg setting aman dhcp paket tracing ny user sendiri kadang heran netijen2 tll tau apa2 modal ngarang iya lo org penting data history bokep perintah sadap cara kayak gt usah jauh2 bikin infra baru tinggal minta isp telkomsel3isat sadap selesai boomer boomer,negatif
fo is the bestwireles busuk,negatif
thats right dude bukan anak ipa tau pakai internet penasaran cari tau sendiri,netral
iyahh memang perintah atur bikin layan wifi kabel optik tuh lewat bersihbersih jabat desa keluarahan walikota suka santai2 kerja mau jalanin program program pintar buat rakyat makin maju,netral
yg sy paham bukan nembus tembok panjang gelombang makin lebar frekwensi makin kecil lebih mudah dipantulpantulkan tembok lebih jangkau lebih tempat lemah ganggu cuaca hujan kabut,netral
f 1 lamda panjang gelombang ratio banding balik,netral
kan bayar sponsor makanya iklan tvcoba cek biaya per detik iklan tv brapa,netral
memang yutub tak seponsor,netral
too good to be true,netral
padahal iconnet plnkenapa upgrade ajakenapa perintah baru suka bikin program baru benar fungsi program belum,netral
bahas sangat menarikenak didengermudah cerna mudah paham daftar ira internet rakyat,netral
tetep biznet bang mah hehehehe,netral
gimik doang internet rakyat,netral
sya malah insecure takut make ira d sadap suka hati akses apa laku hp masuk kritik perintah,negatif
betul internet mahal lot,negatif
dasr tlolbisa murah karna capex beli kabel,positif
pak presiden jangan bikin bikin rakyat capek menghayal,netral
mantaphancurkan mafia data mahal ngotak,negatif
biasa promo awal lanjut mulai ubah polakalau bener buat ladang cuan jadinx negaradari mafiaoleh mafiauntuk mafia,netral
100mbps buat wa nan doang,netral
posibilitas negara sadap device proyek swasta kehack urus negara,negatif
2019 mulai bangun kabel bareng kai 2025 menang lelang frekuensi komdigi optimis bakal menang menang kabel apa bakal disewain provider,netral
internet rakyat ubah harga internet mahal negara miskin,negatif
g perlu harap lebih inti lebih layak beli drpd rt rw net,netral
ha3x daftar susah,netral
nasib indonesia 2030 kayak mana liat ngga jelas sekali,netral
gamers mana suara possible pasang kirakira rumah kalian,netral
yakin ngalahin telkomsel yakin berani lawan telkomsel,netral
nama internet orang mau nyadap semua,netral
kira provider laen digituin,netral
komen orang paham internetuda dulu sadap,negatif
tenang bang sekarang udah sadap data makanya penting baca sk sk bagi jelas sedia layan internet mungkin besar lihat isi device langgan sedia layan sumpah bocor isi device langgan mau tindak apa apa kalian baca sk dulu jangan malas kaya orang literasi rendah,negatif
pikir,netral
make hp klo misal android pihak google tau isi hp apa apa ketik apa omongin makanya ads hp muncul sesuai apa bahas,netral
nama internet seluruh dunia sadap laa luar negeri lebih parah tpi sana kayak warga indo parnoan takut smua dluar lebih parah perintah,negatif
lawak lo kira google meta ig fb whatsapp sadap cari kalian masuk algoritma siapa uang atur algoritma lo,negatif
cs reset modem dulu kak tiang listrik gang belah,netral
sama harga 100k pasar elite starlite fo speed 200 mbps pasar proletar internet rakyat fwa speed 100 mbps,netral
beneran bagus bakal ubah besar indonesia curiga apa lama baik untung rakyat gass jangan ragu rakyat bakal support,positif
d sdoarjo tmpat ortu sya udah kpasang mangkas pngluaran bulan biasa sminggu 50ribu skrg cukuo 100 ribu pke klemahanmya klo ujan,netral
lagi2 kalimantan adakereta tol adamerdeka saja kalimantan ikut malaysia,netral
sy nonton vidio pke internet rakyat resolusi 720p deg cepat vidio 125x gk nge lag,positif
coba soal indihome sangat buruk layan,netral
udh daftar smpe skrng blm info kabar,netral
kayak proyek tau klo rakyat cek cepat 100mbps 10mbps,positif
bang bahas dulu wifi dah terbang tinggi,netral
apa proyek bumn situ tdk 100 percaya utk masyarakat,netral
rtrw net gaya,netral
luar pulau jawa mudah ferguso,netral
alhamdulillah pasang bagus,positif
indonesia jagan expetasi tinggi panggil konoha,netral
prabowo naik presiden hanya alat biar keluarga masuk ranah bisnis,netral
coba diskusi timothy,netral
sedia internet indonesia nyari kaya manfaat kan azaz gantung konsumencontoh awal murah nnti lama lama mahal gila tu,positif
rumah stralaite mudah mudah aman 100 bulan,netral
video 720p kualitas apa 5mb mah cukup,netral
wkwkkwkwk hp mu hp apa dulu hp entry 1 jtaan layar hd 720p mana nonton fhd1080p kwkwwkwkwkwkw,netral
makanya kasih tulis up to fahami provider internet jg pakai trik marketing sprti,netral
telat masuk haha,netral
proyek swasta tp embel2 rakyat,netral
internet rakyat bikin baru mending tekan tuh operator plat merah biar internet murah,positif
udah kerja hepang udah bukan kaleng sekarang gin dah main dota2 make paket data aman buat main ml malah anjol aneh emang game hape budeg satu,netral
udah coba po daftar internet soalny udh sebel data selular kuotany kadang 28 hari anjay udh gt kuotany dikit,netral
politik mustahil apakarena semua libat perintah perintah hasil politik nahloooo,netral
pantes masang myrep 233k include tax bulan dpt 200mbps,netral
g yakinterlalu sangar beneran jadi berapa bnyak operator wifi isp gulung tikartapi moga beneran jadi omon2 belaka biar operator2 g gila2an naikin harga suka hati,netral
projectnya scam gimmicknyabanyak kata lalu lintas data band 14 ghz 100mbps paling top 80mbpsbelum usernya,negatif
ga bangga produk kata rakyat ujung rugi rugi rugi macam bumn,netral
bener sekali sampah jabat konoha raja korup rakyat sulit jabat maling saling dukung,negatif
hulu selalu gebu gebu akhir hilir jadi abuabu,netral
indonesia butuh kait pokitik wasallam jangan harap,netral
starlite user senyumsenyum lihat pasang biasa deket stasiunrel kereta emang,netral
internet rakyat ngebunuh provider bodo krn provider skrg harga paket jg udh mahal2,netral
vidio ngomongnya terlalu cepetkaya ter buru2,netral
indonesia internet paling murah rakyat rakyat nikmat teknologi,positif
produk gk jelas pegawai nanya2 alamat minta foto ktp terus tpi gk dateng,netral
wah hebat minberani,netral
alaaaaaa pas dgr ad hub praboshitt usa hutan ganti sawit percya,netral
tarik plosok gk fiber,netral
harap internet rakyat hampir spt dulu harap bpjs jadi compulsory basic insurance eropatp ingat konoha hampir selalu ntar udang balik bakwan ntah kl dah monopoli harga naik cuci uang nyata 100rb barter data u jual ntar layan jelek awat infra kurang kena bencana alam sabotase akamsi ganti perintah ganti bijak tp seengak2nya alternatif buat duit pas2ancontoh bpjs perfect ngak pasti tp buat uang pas2an tahu sangat bantu biarpun resenya rakyat ikut andil bikin ngak bagus harap krn ngak mau bayar 35rb bulan tp beli rokok bungkus hari ok2 ajasesial2nya kl goyang pasar ksh alternatif lebih murah tp ttp reliable dah syukur kaga peduli kl mgkn nepotisme kolusi,positif
betul g koneksi g mgkin dealin proyek,netral
100 ribu ppn 11 rp 111000,netral
st pondok rajeg blm coverage,netral
sangat nanti ira serius inet mahal banged tipu2 provider naikin harga pemberitahuan jelas,negatif
bandwith internet per gb udah muraaaah perangkat aktif udah terlalu mahal memang mahal infrastruktur main lama diri mau bagibagi tiang sewa mau akhir main eksisting rugi rakyat untung dapet surge walaupun mungkin konten politik situ rakyat untung dukung,negatif
5 hari trakhir wfi tmpt lot ap mngkin pusat pindah pke wfi rkyat kuat intrnt lancar tp sngt lemah,positif
harga murah kenceng customer service tekhnisi cepet masalah jamin langsung pd migrasi ksana,positif
warga kabupaten sambut positif biar provider naikin harga kuota enak 50rb 10gb lebih sedikit 100rb bulan perlu ribet nunggu kabel akses rumah sy stuju program,netral
100mbps internet kenceng murah yakinstabil noooo mungkin,positif
curiga logo liat kayak niat buat,netral
esa efek tiba2 tagih iconet turun 10,netral
bang link bener internet rakyat mana bang,netral
non sense ujung2nya korupsi mark my word,netral
5 05 njiir izin ormas ilang faceorangefrowningfacebluesmiling,netral
nama internet rakyat udah susah dipercayaudah kayak gimmick2 partai atas nama rakyat gimmick wong cilik,negatif
wah abis nonton video gk mau pakai internet rakyat lag stabil murah tadi nyaman buat apa zzz,positif
btw myrepublic ngumumin harga program buat coverage area lho,netral
mudah perang hargainternet ikut turun harga,netral
repeaternya tower centratama rel tower jarak 15 km butuh fiber optik 1 tower centratama mengcover 360 derajat maksimal coverage 500 meter tetep butuh optik covernya luas,netral
daftar konfirmasi lanjut,netral
0906 soal cs bang handling konsumen tengah atas tengah bawah jauh sekali beda soal sedikit alam lomba nasional mana konsumen heterogen tengah atas tengah bawah meski keluh lebih mudah tangan konsumen tengah atas lebih duit hehe,netral
joos lanjut internet murah,positif
tarik tp ortu kyknya g mau speed g stabil soal suka nonton netflix youtube sm jenis kasi csnya tar komplain mulu pk iconnect ganggu jam langsung komplain,positif
moga program bantu masyarakat,netral
dukung nihlanjutkan,netral
papar orang bodohlantas apa manfaat masyarakatbiacara teori solusi tindakanbukan dar omong kosongcerdas dangkal otak,positif
kuat telkom bumn negara cepat upload download data bukan bisnis bangun server baru,positif
masalah yakin bokap buat pindah indihome salah indihome kan bundle tv kabel gitu bokap sering nonton tv channel luar negeri keluarga nonton mending streaming youtube an bokap wkwkwkwkwk,netral
sangat tarik sangat sangat bantu financial masyarakat asal sistem operasi benar isi org org kompenten bukan asal asal moga indonesia capai citacita aamiin,netral
ikut pre regist si ira sebenernya udah langgan biznet 0dkalau emang beneran lumayan buat load balance tinggal tambah mangle rules buat gaming mode traffic game lewat fiber traffic browsing streaming merger 2 isp,netral
monopoli ujung ujung kuasa lalu bentuk harga enak jidat ingat pertamina sebentar gotograb merger awal mungkin bagus lama lama kualitas makin hancur harga enak jidat,positif
cekik harga telkomsel asa balas cekik,netral
paling kuat 3 tahun tau siapa bikin awal,netral
beberapa internet pernah 1 indihome mahal lemotteknisi kurang gercep cs kurang peduli peket bulan ubah ubah 2 my republik kenceng murah teknisi kurang gercep cs abrul adul after sales jelek3ion net murah lot,positif
teori bagus eksekusi engga tau karna bkin tower cell mahaal,positif
daftar eror terus udah 100 kali daftar,netral
btw bal internet mtm 200mbps harga 300rb global extreme 200mbps harga 240rb bayar tahun 100mbps 100rb possible,netral
bagus emang target tercover rata luar daerah sekarang paket internet hp emang udah layak it harga si merah mungkin rasa si merah saing bebas suka hati naikin harga internet kuota pangkas sedikit mungkin,positif
wifi rakyat cocok desa solusi masyarakat kurang sinyal,netral
saat wifi swasta dh masuk desa2 turut program g jelas paling tr jaring ganggguan mulu tau kelola perintah,netral
sy daftar tp informasi pasang,netral
ujung2 bakal jadiin monopoli oligarki kuasa,netral
yg hashim adeknya presidentarget konsumen tengah kebawaharea utama kabel jawa karna jalur kereta paling disanafix siap brainwash 2029siap2 ntar internetnya iklan 2periode,netral
so bener internet rakyat bukan internet korporat,netral
tuh icon plnoptic tower sutet pln,netral
14 ghz iya tanah kosong sekarang hahahaha cek spectrum crowding guys lihat kayak manipulasi goreng saham,netral
harga data telkomsel papua gila bnget moga internet rakyat mnjdi solusi,netral
mulai percaya lebih bulan daftar hasil hari tindak lanjut satu2nya respon terima kode otp daftar malah curiga daftar mengumulkan data pribadi telah tiba2 hubung tawar bagai macam asuransi tawar pinjam dealer tawar mobil tawar trading saham judi online bener2 aneh,netral
yahini salah satu tuju kuasa duga,netral
kampung internet desa 100 rebu bulan kenceng parah,negatif
awal semgtpas tau nama hasim pesimisbpa kty mo naekin gaji guru ama bkin rumh buat rakyt yaahsudah,netral
apa sini udh pakaigua dah daftar info,netral
gmn cara bro sy mau beli layan internet rakyat,netral
starlite 100k 200mbps,netral
internet rumah ku ngelag malam,netral
banting kmrn harga saham bandar,netral
bodoh daftar situs sadar gara gara liat beberapa postingan influcer ngomongin daftar lengkap nomor ktp alamat lengkap notif sekali sekarang asli gocek urus 1,netral
1 juta rumah mana internet murah 1 juta rumah seperti skizo,positif
harga rupa,netral
kota xl jual paket unlimited bener2 unlimited harga 20rb per 10 hari bulan 60rb cepat up to 50mbps ping stabil,positif
gratis elon musk pungli ginian,positif
minta data diri takut padahal jaring,netral
pinter provider lokal sdh jual in tinggal bantai sma internet perintah smart planning tau depan,netral
nyata kabel optikmacam indihome cuaca mendung maupun hujan jg muter2 lancar,positif
internet rakyat rakyat masa jabat ikut internet rakyat,netral
raymon kan lelang kan 3 regional fwa harga jawa papua harga sumatera kalimantan sulawesi,netral
sulit percaya lg,netral
apa indihome cuman bagus speedtest realita suka putusnyambung,positif
cocok buat telkom mikir bener lama telkom pln manja hak monopoli direktur males malesan btw kang rey sekolah perusahaankantor perintah tarif premium mulaindari 250rb utk konsistensi indo kota besar kabupaten fiber optik asu ping naik turun kyk harga cabai mau provider apa internet rakyat tarik,netral
omon omon wowo,netral
too good to be true harap free politik,netral
klo telkom reaksi arti scam alias fup rendah speed rendah balik klo telkom reaksi bener,negatif
bos islam bukan islam n tipu halusin nyata bos,negatif
100 mbps 90ribu 100 ribu masuk ppn 11 mustahil ndak seram ndak,netral
company besar main smooth suka lihat beberapa tahun lalu pertama kali coba surge kereta awal tulis nama usaha panjang jalan nikmat internet gratis walopun stabil terus mikir untung mana pasang videotron itu diiklanin lebih produkacara sendiri nyata planning jauh depan kuasa jalur kereta ngembangin produk,positif
udah daftar eksekusi,netral
pandang teknisi salah satu usaha besar indo internet rakyat eksekusi bagus konsisten kualitas kuantiti yakin bakal gacor damn banding balik justru bakal nama harum provider opini,positif
bro edukasi lo banyak jelas inget zaman dulu provider lebih mahal sekarang alhamdulillah jauh lebih murah lebih murah internet indonesia masuk masalah dulu,positif
lot bng sini,netral
ragu curiga,netral
kawan bongkar semua data internet masing usaha makin jelas curiga korup padahal waktu aku buka apk sebentar eh udah langsung garap per 50mb 100mb dah hilang tikus balik batu diam makan uang smpai miskin rakyat,negatif
sempat2nya masukin biaya ormas nice,netral
