text_stemming,pseudo_label
konsep kaya hot spot area dulu,netral
download dapen rata2 stabill 4045 mbps download 8mb an per detik,netral
ngeri bakal kontrol alias sadap,negatif
bau bau esemka 30,netral
aneh provider lot parah,negatif
aq dulu pk indihome byr 350 rb skrg aq pndah pk 100rbuan lumayan nonton bola gratis bang emang lelet,netral
harap besar moga beneran hasil meski maksimal hidup kampung mau start streaming biaya wifi rata rata mahal buat start streaming internet rakyat minimal nyentuh 15mbpslebih syukur depan rumah tower bts moga eksekusi rapih,negatif
mana urus perintah masyarakat sendiri 1112 sableng,netral
tunggu 35 thn rilis korup triliyun2 buka spt ektp projek lain,negatif
wowowowow,netral
ingat orang kaya india jua murah besar kolep,positif
fwa pernah dulu main 33ghz gagal,negatif
gak goda kwalitas tetep indihomedi tempat sy macam usaha internet pertama murah tpi lama2 dgn indihome kwalitasnya bawah indihome,positif
nonton make wifinya,netral
internet murah baik sekali ingat mental mafia sdh hati rakyat kerja si mahal maju besar nyata tahu tahu internet murah mahal kayak gojek greb m nyatu mahal karakter elit usaha ingin inting besar segi manusia politik,netral
gk berani jelasin kan open ran kalah jauh ama fiber stabilitas kaya model 3 nembak tiang rebut satu kampung mampus inet kata amrik kor jepang china gk pikir spt bodoh china udah 10g tipu itujangan bahas inet mending ajar kang ono dulu inet harus udah angsur cepat tv analog pakai frekuensi harus internet makanya perintah nyuruh tv digital pihak sedia maka frekuensi harus dr dulu internet jaring beres waktu dekat korupsi nasdem si partai internet cepat buat apa 4g udah gk main soal ping dimana2 ping based on sg misal main game si developer bikin node eu hktaiwan usa biasa dev ogah,positif
gk mudeng c aku,netral
sounds good lets see bagaimana eksekusi,netral
ujung ujung cuman jawa jawa paling,netral
tarik koh buat daerah pakai fiber ping maksimal,netral
bagus aku tunggu,positif
smua internet diiindonesia tu mahal eks xl indosat simpati kwalitas lelet pa mendung maw hujan smua brengseek,negatif
masalah kelola stabil politisasi surge tumbang telkomsel,positif
harga internet makin mahak sangat mahal 20172018 kuota 17g 20g aku pakai bulan abis pakai standar internet desa sekarang pakai standar kuota 40g mencukupiparah,negatif
perlu coba,netral
frekwensi 1 ghz tembus tembok,netral
apa mini 1221 nagihnya eleganlook premium flow lembut mantul,netral
server perintah kayak gembel,netral
jujur mini 1221 bikin penasaran terusgrafis cakep alur ngalir suasana naik,netral
operator indonesia jual mahal 28 hari indonesia bisnis ngak masuk akal,negatif
mini 1221 definisi smoothsemua elemen on point cobain puas,positif
serius mini 1221 bikin nagih visual cakep flow mulus adrenalin naik cobain,netral
asli kantorcabangnya samping rumah ruko mahal borong habis lama daptar hampir semua warga daptar realisasi jalan sekarang,negatif
nama buzzer mafia koruptor mah selalu nyinyir bijak perintah internet mahal kritik kasih murah tetap kritik aruhhh udah dislike vidio lue,netral
awal tau starlite langsung cek coverage area nyata desa lalu munculah internet rakyat udah menang tender jawa pikir menang ter cover desa nyata tercover memang desa pelosok provider pasang jaring fiber jujur penting internet syukur desa masuk coverage internet rakyat yakin bakal langgan,netral
internet rakyat sangat wort it harga murah speed kata walaupun samapai 100mbs sangat2 murah keluh kesah bayar mahal tpi speed lelet ping kadang loncat2 hello mending internet rakyat murah speed ada akal mau cepat anggap beli 2 paket tinggal buat lb speed double anggap beli paket 200rb seperti kalah internet indihome harga 300rb cepat 20mbsaku yakin kikis internet rumah,positif
klo perintah berani untung rakyat sii moga,netral
moga sebar seluruh nkri,netral
indonesia apa manipulasisemua sesuaikarena kelola negara sehat,netral
korupsi kuat modal bang,netral
udah coba kalah myrepublic,netral
inget bolt dulu haha,netral
pantau indiehome tinggal kabar mau layat,netral
cuman ken internet lancar susah udh ganti 2 layan internet lag mahal pulak kurang 1 tahun kena denda policy terlalu sulit langgan terlalu lama 1 tahun,netral
sukabumi tempat tinggal pasang murah riah 100 rbu bulan dngn cepat ny sangat waw pis hadeeeww ngabret depan naik harga tdk rakyat mah cabut apa susah,positif
505izin ormasmreka hak apa,netral
udh daftar liat beneran eksekusi apa gak,netral
solusi provider turun tarrifnya sekarang utama telkomsel haloooo telkomsel jangan india saran 1gb rp1000 siapa tuju,netral
narasi lewat cepat bung lambat sedikit simak sempurna,positif
pakai wifi 75rb perbulanspeed pentingasal anak istri pakaikalau mobile dijalanpaketan sendiri 6 giga perharispeed 3mbps dah kenceng,netral
omon2,netral
lebih tarik starlite,netral
gak usah pusing coba pasang beberapa bulan rasa ntar tau layak it 100 per bulan ngancurin provider senang hati pasang,netral
hati2 data kalian curi perintah,netral
bom percaya bakal bagus udah kapok internet merah internet ungu tiap bulan 2x loss merah internet si huruf b baik karna udah 6 bulan gaada error sekali harga cukup lumayan,positif
aku pernah kerja salah satu isp swasta besar indonesia benar internet rumah murah utama bundle international input bandwidth beli besar pungut liar hilang fwa ganggu baik effort connection teknologi atur bandwidth hardware cache engine ai ganggu atas turun koneksi internet tv suara paling baik kabel,positif
siapa mau internet murah,positif
internet perintah perintah korupsi,netral
klo daerahkabupaten harga 100 ribu unlimited work it,netral
kait dadak bahas internet rakyat saat harga saham wifi inet ketr longsor,netral
rem aah klo,netral
at this point i cant trust any government program any more too good to be true is the key,netral
ingat waktu bangun rel kreta double track panjang sisi rel bikin macam selokan cor2an kokoh lebar 15cm hampir 1m kata buat nanam kabel,netral
pantas sy pakai paket bulan salah satu provider 10gbbln bulan lalu naik 50gbbln dgn harga,netral
kuat backbone jaring fwa 14ghz banding existing provider resiko nasib bolt main fwa frekuensi 23ghz,netral
beda ama starlite apa sama2 100rb 200mbps perbulanspeed kadang bagus kadang amit2 sabar,positif
aku daftar minggu lalu tp trs gatau lanjut apa sekarang masa preregister buat 1 bulan pertama gratis,positif
tetep bakal jegal plat merah coba paling regulasi rubah heheh,netral
betul internet sampah lot ngga siang hujan lot parah,negatif
pullux hotels rilis obligasi seni 500m worthit ko,netral
arti mirip2 tsel orbit isat hifi meski beda frekuensi sinyalnyayg suka konsep wireless alias perlu narik2 kabel hubodp rumah2 mungkin perlu core odphub lokasi letak dekat dgn core cukup bangun 12 bts sinyal rumah2 lebih rapi kayak skrg kabel2 inetwifi rumah semrawut jelasga rapisemoga eksekusi dgn sangat baik beneran tarif 100rb per bulan klo masalah speed asal atas 50mbps hitraffic oke,positif
keren bang,positif
gassss,netral
malah keinget anomali bilang internet cepat buat apa,positif
terlalu manis blm proven stabilitas layan customer handling masalah yaa saham bagi milik keluarga kepala negara tau security bakal last mile atua selesai customer,netral
harga ram naik tahun depan pengaruh tarif inet data server operator butuh,netral
aku daftar internet rakyat registrasi,netral
penting nonton youtube dengar profesor doktor magister argumentasi anak anak wi fi tonton suka puas uang 100 ribu terimakasih bang narasi,positif
gak gampang kakak usaha beri mimppi,netral
paling penting 1 bulan 30hari,netral
makin ngotak harga paket data,netral
medan magnet be like cuan,netral
data ancam,netral
tinggal kuat ngga modal,netral
bagus fwa lebih estetik udah muak liat kabel optik depan rumah beranta jauh lebih murah,positif
mantab,netral
bahas tarik wait and see,netral
moga kayak bolt,netral
sdg coba daftar bulan desember awal sdh kirim no otp wa koneksi web selalu putus kek omon2 dobolll,netral
internet sekarang dah masuk kamung2 lihat berapa langgan dulu telkomsel pilih2 kini indosat gesit 200 rb per bula ceka berapabnyak pelang indosat kini,netral
bts 4g korupsi mau 5g kapan,netral
moga hasil udah muak pakai telkomsel harga mahal,negatif
bukan scam kamu ngomel pingnya arti kamu bukan pasar,negatif
apa proyek perintah gk bner,netral
harap wifi ira sukses mana kompetitor turunin harga bener masalah besar kasus fitur wfa balik klo suka cepet paling enak emang pke kabel optic langsung colok kabel lan komputer,positif
utk rakyat nama murah rakyat senanggak,positif
moga nirkabel semrawut kl pk kabel,netral
awas nti data data akses luar,netral
rakyat mmg untung dgn internet murah tp provider bangkrut lalu jadi phk besar spt jual online murah tp bunuh sekian usaha rakyat untung siapa modal besar g akhir gelintir org nguasai bagi besar ekonomi negara,positif
udh pre order kelanjutannyaaa,netral
ga konsisten pingnya,netral
aku yakin ira jegal main,netral
makanya harga murahin gk orang wifi sering keluar,netral
swasta nawarin 100 rb bulan,netral
kayak bobibos,netral
gwa pre regist 8,netral
internet rakyat solusi baik indomasalah ganggu atas bilang cuacamati lampusemua provider jg lot aksesjika ada cuaca burukyg problemcara daftar lohdimana gerai2 internet rakyat kelihatannah jadi gangguankita ngadunya mn emang online terusga praktis lambat tangan masalah onlineteknisi datang cepat gangguanbeda gerai2 internet rakyat lihat kayak indihome misal,positif
tempat ku kadang 200kbs300kbs oaket harga mahal,negatif
internet murah buzzer makin limpah,positif
100mbps keroyok beberapa orangbagi kelompok pertama bagi kencengyg akhir nyemplung sekali ngerasa 100,netral
lebih murah qualitas cepat pindah simple,positif
inti dulu naik harga terus terus pindah tempat awal lebih murahpasti bangkrut sendiri nyakarena dana awal harga murah,positif
jangan percaya harga murah pelopor orang perintah anggota parpol udah ingat politik kotor halal segala cara,positif
300kbln 6mbps paksa sy pakai krn hemat banding provider sedia smg internet rakyat lekas masuk daerah sy sulawesi tengah morowali,netral
ga yakin menang tender kuasa beda,netral
10 mbps 140 ribu wifi internet indo bener mahal beda malaysia 65 myr 500 gb sah 28 haridi indonesia bener mahal,negatif
beli kuota udah ampe 250k bulan ngelag sekarangxl telkomsel jauh beda,netral
100mbs 125 mbs lambat oke,positif
proyek adik kakak,netral
lebih wireless internet emg reach target pasar masyarakat ngga internet udh benermirip starlink mereka bukan kabel satelite koneksi maksimal reach,netral
nikmat daerah malang sekitar,netral
moga nyampe sumatera rumah kota tpi nyampe wifi kabel kesel 5 tahun ubah keluar 150200rb keluar pakai bulan kuota 300350gb,netral
belanda internet murah indonesia jauh lebih mahal negara negara masuk kata gori negara nggk jelas nggk sadar sini mahal nggk jelas,negatif
dulu waktu milu salah satu calon mengratiskan internet malah tolak,netral
curiga buat sy utk sadap masyarakat krn sumberdaya n latar belakang kelola lgsg perintah,negatif
udah daftar 1 bulan blum balesan jangan2 abalabal raja jawa soal mobil smk,netral
aku rasa kompetitor berani hajar provider besar makin kesini makin mahal koneksi gitu alias makin ekonomis fakta segala makin mahal koneksi internet makin komoditas primer aspek bisnis edukasi umum,negatif
patungan kurleb 15rbanbln langgan wifi buat warga utama emak2 bocil2 monitoring cctv online,netral
logika ngga masuk mana usaha mau rugi pikir something behind,netral
100 pembodohanini bisnis mengatasnamakan negara rakyatdi tempat ku pasang wifi 100rb langsung nikmat biaya sewa sewa alat ketawa pas berita wifi buat rakyat tetap bayar 100rb bayar 50rbbln baru rakyat bukan dar bisnis selubung,netral
bayang akses wifi nyaa kasih dulu propaganda kampanye melajutkan 2 periode lama lama naik harga nyaa,netral
inget awal awal masang indihome bayar 220ribu tahun naik 270ribu bulan 12 gratisinada buat senang daftar atur aneh harga naik pemberitahuan,netral
mudah paham penejelasannya khawatir orang2 jaring jawab,netral
baru pindah indihome cbn masak langgan lama 8 tahun 466rb speed 30mbps,netral
ga stabil tp ray udah starlite dikit dikit dc,positif
bantu korban banjir sumatra kena pajak bea cukai tim diaspora,netral
bukan internet rakyat internet jawa,netral
desa udah lumayan nyediain layan per bulan 100rb walaupun 2mbps beneran 100 mbps oke kaya,positif
internet cepat buat apa kata makhluk jelas lahir lobang mana realita tetangga pensiun pns umur 70 an awal bulan anggukangguk gelenggeleng sampe teler otentifikasi pensiun jaring buruk sendiri main game ikut event adu cepat ngetap lawan orang kawasan asia tenggara selalu kalah jaring busuk eh maaf lebih tepat perintah busuk korup,negatif
alas kurang mungkin perang 14ghz,netral
tunggu tahunberap realisasi daftar respon sekarang,netral
pakai rmh net 100ribu speed test 100mbps up 3 bulan oke2 asyik coba dulu hemat keluar keren unlimited lama udah mahal tiap ahir bulan 2mbps buffering sekarang masyarakat makin maju makin buka monopoli sekarang nunggu jaring telpon swasta biar makin hemat moga harap,netral
hubung internet data informasi akses ngomong scam internet scam usaha provider swasta takut laku internet rakyat lebih murah makanya provider swasta jangan terlalu mahal kalian kenyang lama bohong rakyat indonesia,negatif
100 rb dpt brp giga,netral
bikin was2 eksekusi bener,netral
memang freq 14ghz real bagus tembus tembok memang bandwith up to 100120mbps bagus interverensi alat beda 24ghz karna alat rumah pakai 24ghz wifi microwave wireless speaker,positif
klo buat konten,netral
mirip kyk orbit telkomsel bagusssss,netral
ijin ormas,netral
sy cikarang sdh 2 bulan nikmat speed up to 200mbps bayar 100kbulan free biaya pasang router free bulan pertama alhamdulillah jauh sy pantau speednya stabil 170an mbps mau tau nama providernya,positif
desa internet 150 ribu per bulan pakai hp tv provider tetangga rumah jalan jalan mas pelosok jabar internet 150 unlimited,netral
hasil monopoli kaya pln tuh,netral
guna oxygeb bulan 300 mbpsgua udah daftar internet rakyatkl emg maaih wort putus oxygenkarena buat rumah cm buat yotube keluarga,netral
ga cocok buat gamer kompetitif arti soal temen ngebet maen lol masalah mulu internet,netral
user ira jauh sinyal stabil sinyal ilangan cs hubung susah,positif
waduh memang itukasian mafia seluler dongyg buku selalu rugi internetnya mahala mulu,netral
yg kluar 1mbps,netral
metode wireless gin lemah bandwith cuaca rame speed bakal turun cuaca jelek speed turun harga murah giur buat pasang alhasil user speed 100 mbps janji bakal turun usaha telekomunikasi selamat mau inovasi andal unggul fitur fitur punya wifi fiber optic bakal mati perlahan saat internet rakyat makin tower pancar masalah bandwith atas,positif
marketnya sendiri2 indiehome buat tengah atas butuh stabil wifi rakyat buat tengah bawah penting stabil asal murah starlink buat daerah2 pencil minim akses internet daerah pulau pegunungankalo perusahaan2 saing sehat untung konsumen pilih,positif
informative thanks bro,netral
lihat video selesai sesuai nama internet rakyat lebih fokus rakyat internet murah unlimited penguna ingin cepat stabil bukan,positif
ini berkah pak prabowo presidentrakyat senang negara cemerlang,netral
fwa bakal saing fiber optik kualitas,netral
jujur agk skeptis internet rumah backinganmenggesek politikkalau inet lbh milih independentkarena nama inet mau atur terterasiapa jamin data aman guna inet murah tersebutya bukan siapa2 pny data penting data2 remeh penting apa mau apa tau apa laku apa cari segala aktifitas inet murah kumpulindijual analisa penting politik depan nyamisal rakyat butuh apatertarik dlm apananti milu data patok mikat hati rakyatlalu tarik apabisa jahat besarditutupidialihkan paling tarik pikir rakyatmungkin pikir liar halutapi bayangin inet murah a dipake hampir seluruh rakyatterafiliasi dgn tokoh politik guna data pakai tang penting politik tutup jahat dgn bombardir informasi tutup hasrat tahu benar alih isuyaudahhhh selesai nasib semualalu bahas selanjutnyaseberapa besar efek frequensi 14ghz tubuh manusiamahluk hidup,positif
aku oke internet 100ribu 100mbps nama internet baru murah soal hack an apa kan batas data manipulasi penting murah stabil misal naik harga masalah asal stabil dlu cepat naik 100200 ribu masalah total 300ribu internet tetep wuswush sekarang beli kuota mahal bukan main mana lot 1020mbpssecond benar peras rakyat,positif
memang bener internet stabil mahal udah tahun pakai my republik cepat stabil kencang jam berapa mau live streaming mantengin candle forex main game lancar keluh kesah,positif
malah kelas tengah bawah brsikap wajar dgn hrga segitu qt bayar internet rumah mahal ttep rasa speed rendah betulin jka qt komplain cs,negatif
telkomsel simalu monopoli parah jaring kaya sampah masyarakat sini tempat malu utara starlink sekarang program padahal telkomsel sampah wokwokwokwkwk,negatif
bagus segitu harga lagi kyk kartu sinyal pancar,positif
1036 masyarakat ekonomi rendah nuntut udah internetan murah udah neng,positif
cam tangan perintah jasil butut,netral
333000 100mbps masang apa 300000 300mbps,netral
i knew it,netral
dasar internet gratis nama istilah industri,positif
mending swasta bau bumn banyak profesional noh si kom kom lot harga mahal,negatif
wifi target 15000 kali ko coco pegang wifi,netral
moga realisasi baik imo telkomsel sendiri sekarang monopoli gila2an bikin harga enak jidat dulu 100 ribu beli 95100 gb 100 ribu jaring lumayan lancar sekarang downgrade parah 120 ribu lebih 50an gb grafik jaring jijik lot promo hampir guna orang tinggal daerah pelosok telkomsel jadi satu2nya pilih mau mau pilih walaupun kualitas dulu guna provider makin buruk bangun tower bts galak ubah signifikan apa guna komentar pribadi dasar alam daerah pelosok jauh kota besar,positif
mah kayak orbit teknologi beda skema doang tetep ngandelin jaring bts 4g5g orbit sering ampas makin kesini harga paket dah mo kayak telkomselnyasimpatias,netral
ane si dukung dlu,netral
daftar lanjut modem kirim tindak lanjut submit data scam data buat apa,negatif
tahu internet desa2 layan guna fiber optic isp isp daerah bukan isp nasionalharganya murahmasyarakat indonesia kenal kreatif jangan salah,netral
,netral
kuota murah kuota mahal gantung operator paling benci terkadang kuota sering hilang,netral
ormasssss,netral
beda jaduh mbg indah awal mencret jalan,netral
soal hacksadap program republik indonesiaentah benar aq yakincuman logis sempat situ mungkin,netral
lucu internet 100 rb mahal buat rakyat murah buat korporasi rakyat tu pakai hp chatting masa 100 rb lucu uang hasil ngeruk udah abis tinggal pusing tuh,netral
jokowiluhut ganti prabowohasyim,netral
jaman dulu begituutk backbone fo kerja kai jalan tollast mile wirelesstp perlu koneksi kuasa utk kerja dgn kreta api tolklo pure b2b uda kasi harga mahal lahan utk lewatin fo,negatif
suka internet rakyat papa provider gulung tikar masa biaya kabel optic tower mahal memang buat instalis kabel optic 1 rumah hari tower 1 meter kan enggak tutup untung rugi korupsi kalian pernah hidup tahun 90 an kalian tau dulu tonton acara tv pasang antena tv biaya tarif bayar bulan kenyataanya sekarang gratis ht jaman briker dulu bayar kenyataanya sekarang gratis dasar alam sedia gelombang jaring biaya teliti awat mahal wakanda negara setan harga mahal kualitas busuk layan orang orang sdm rendah nyogok kerja konspirasi buser luar negri mahal mahal sedia area khusus sadar internet butuh pokok era modern cerdas rakyat program upaya perintah maju bangsa satelit eh malah jual nenek ngaku bapak pahlawan padahal kacung belanda kan parah internet jangkau perlu gratistinggal aman tingjatkan jahat perintah sendiri balik iklan iklan judol pinjol campur tangan perintah judol pinjol jamur wakanda tentang tulis orang bodoh buzer perintah pangkat pangkat cere kelas jabat baca paham buat apa apa emang birokrasi monopoli wakanda berat saing barat timur nama merdeka sarat terimakasih info mas keep sharing,negatif
indihome primetime ngeleg,netral
kalian percaya perintah akusih engga masyarakat mudah bungkam mudah lacak dapet uang banyakk dulu negara udah model jepang model china barudeh mau,netral
klau bener internet murah 100 ribubulan koneksi cepat lot apa mungkin konoha kadang berita bombastis real sesuai ekspektasi,positif
internet rakyatya tuhan aku wni,netral
nyimak,netral
bagus indihome telkomsel udah koneksi busuk mahal emg kikir sekali hantam biar tutup sekali,negatif
1034 makin miskin makin rewel sesuai netizen komen2 ngawur,netral
tetap provider kabel optik aman wireless stabil,positif
wah makin lambat perintah tangan bencana alam dana negara alih kembang internet rakyat,netral
tetap optimistis 1000k bulansampai kapan,netral
bener d daerah internet makin lelet makin mahal tsel sampah emang,negatif
apa nama telkomsel mahal speed internet kya tae,negatif
provider internet sadap data warga negara lalu kirim amerika contoh usaha anti virus cipta virus usaha terus kembang,negatif
buat maen game butuh internet cepat buat puter video ajar tiktok youtube wasap 15 mbps udah cukup,positif
aku guna starlite hp 5g internetnya kurang lancar cenderung kadang ilang ilangan ilang beberapa jam kadang hari,positif
tarik bung murmer jg,netral
bang coba bahas blackbox dawn internet bang,netral
murah unlimitit sk fup,positif
internet daerah 100rbbulan kenceng iya stabil iya murni lancar stabil kala jumping2 kala data hari jauh lumayan bagus murah,positif
ntah semenjak internet rakyat indi makin kenceng speed rumah,netral
stb openwrt tembus 150mbs cuman 65k nyaman internet fiber optik,netral
to go to be true,netral
yg ikut ipo tahan 10 tahun ibarat rupiah dollar,netral
bang raymond usut kasus tipu investasi pt dana syariah indonesia mana 14099 lender buat derita lahir batin uang harus ambil tahan pt dana syariah indonesia hubung ketua paguyuban lender dsi jadu jubir lender korban terimakasih yaa bang moga jadi perhati abang,negatif
daerah tentu infrastruktur rel kereta api khusus pulau jawa,netral
bulsit ah negara rampok uang rakyat internet,netral
resiko perintah mau bungkam denga mudah ip dimatiin,netral
wajar menang lelang adek presiden,netral
bakal percaya,netral
byr 100 rb 100 mbps bukan gimmick bukan boong dah hampir 3 tahun stabil teman2,netral
meski ada indonesia guna internet rakyat sangat suka bahas isu jaring tanah air anda indonesia dukung langgan layan walaupun mungkin milik opsi koneksi lebih baik dukung perata informasi cipta ekosistem digital baru lebih besardengan teknologi eksekusi benar program bawa ubah besar kunci integrasi farm server data center dc guna backbone internet rakyat jadi menang pihak baik guna akhir maupun kelola dcsaat tinggal indonesia jumlah dc sedikit backbone internet rakyat sambung langsung direct peering dc panjang jalur biaya hosting tekan drastis dc dapat akses langsung juta langgan cepat stabil tinggi lalu jalur optik tara kualitas interkoneksi antar dctentu tantang lapang cuaca potensi bottleneck pop point of presence jadi risiko diminimalisir pop sambung backbone utama guna jalur fiber optic kuat paksa guna nirkabel wireless lokasi sulit jangkau optik guna pita frekuensi lebar biasa berbayarlisensi khususperlu ingat hebat apa link wireless milik batas fisik rupa shared medium satu jalur pakai beramairamai beda kabel milik port sendiri dedicated pop terlalu padat andal wireless kualitas menurunmasalah mungkin timbul konektivitas internasional internet rakyat milik link langsung pada dc lokal beban lari link internasional sama link memang internasional padahal link internasional harga sangat mahal meski akal manajemen bandwidth batas teknologi telekomunikasi tetap adanamun internet rakyat hasil hubung langsung bagai dc lokal picu revolusi digital guna rumah pakai fiber optic provider mungkin tarik alih layan stabilbagi sedia layan isp perlu terlalu panik izin diri menara indonesia mudah lokasilokasi premium biasa asai main lama mungkin butuh waktu lama internet rakyat mati kompetitor laku gebrak besarancaman benar justru datang starlink milik modal raksasa butuh pop lokal butuh base station bangun mana daerah murah asal hubung jaring lokal indonesia skalabilitas starlink jauh lebih takut banding sedia lokal manapunkesimpulannya mungkin buruk internet rakyat koneksi lancar akses situs situs lokal hubung backbone lebih cuaca buruk jumlah pop banding membludaknya jumlah guna satu area turun kualitas layan jadi,positif
alhamdullah emng internet rakyat,netral
perlu perhati berita internet rakyat saat internet jauh makin lot lini wifi tri telkom xl apa kadang sampe susah search google doankcoincidence,netral
teknologi tarik bener rakyat terlalu clickbait dah teknologi wifi fwa kya gin udah dipake perusahaan2 besar kan kaya kantor prabrik bangun,netral
kalian sua tlll d kasi daging malah terima,netral
bisnis n saing sehat jangan rekayasa rugi masyarakat untung jadi haram hukum,netral
bener unlimited penting bodo ama ping bawah 50ms aman,netral
nikmat lama untung peduli setan balik tp tetap waspada pinter dikit,netral
aku pasang wifi gratis iur bulan 100 ribudan omon omonkalo percaya datang daerah jogja klaten solo boyolali semarangsemuanya samabeda antenawifi ku rumah tiap hari malem 11 sampe 15 orang main rumahsetiap harijaringan oke,positif
buat g lbh tanya arah kapan tender frequnsi laku aneh pita 24 ghz rame rame monopoli bau kkn kenceng 100rb rada aneh si target minimum customernya brapa biar masuk itungan buat inveatasi baru 5 g arpu tetap 100rbbulan lumayan sebenernya subsceibernya cukup besar nutup biaya operasional cek rata rata operator skarang jauh segitu,netral
jangan lupa tower sama infra stuktur bts se indonesia,netral
denger nama curiga jauh nonton video tarik irakalo udah bener si ira harap kuota internet murah,positif
harga 100k up to 100mbps oke sini indihome laku karna mahalada fup daerah rata2 laku pakek rtrwnet walupun mahal 120k dpt 20mbps unliyg hancur duluan wifi rtrwnet internet rakyat stabil sering ganggu profider lokal ikut hancur,positif
